Artista,Reproducciones,Oyentes,Biografía,Artistas_Similares
Killswitch Engage,69105014,1493352,"Killswitch Engage is an American metalcore band from Westfield, Massachusetts, formed in 1999 after the disbanding of Overcast and Aftershock. Killswitch Engage's current lineup consists of vocalist Jesse Leach, guitarists Joel Stroetzel and Adam Dutkiewicz, bassist Mike D'Antonio, and drummer Justin Foley. The band has released eight studio albums and three live performance albums. Their eighth studio album, Atonement, was released on August 16, 2019. <a href=""https://www.last.fm/music/Killswitch+Engage"">Read more on Last.fm</a>","Times of Grace, Light the Torch, All That Remains, As I Lay Dying, Trivium"
Children Of Bodom,78831914,1117205,"Children of Bodom was a Finnish melodic death metal band from Espoo. Formed in 1993 as Inearthed, the final line-up of the group upon their split in 2019 consisted of Alexi Laiho (lead guitar, lead vocals), Jaska Raatikainen (drums), Henkka Seppälä (bass), Janne Wirman (keyboard), and Daniel Freyberg (rhythm guitar). The band released ten studio albums, two live albums, two EPs, two compilation albums and one DVD.

The band's third studio album <a href=""https://www.last.fm/music/Children+of+Bodom"">Read more on Last.fm</a>","Bodom After Midnight, Norther, Kalmah, Warmen, In Flames"
Mötley Crüe,51339727,1699166,"Mötley Crüe is an American heavy metal band formed in Los Angeles, California on January 17, 1981. The group was founded by bass guitarist Nikki Sixx and drummer Tommy Lee, lead singer Vince Neil and lead guitarist Mick Mars. Mötley Crüe has sold more than 100 million records worldwide, including 25 million albums in the United States, making them one of the best-selling bands of all time.

The members of the band have often been noted for their hedonistic lifestyles and the persona they maintained. <a href=""https://www.last.fm/music/+noredirect/M%C3%B6tley+Cr%C3%BCe"">Read more on Last.fm</a>","Poison, Ratt, Skid Row, Cinderella, Vince Neil"
3 Doors Down,71807819,3119816,"3 Doors Down is a post-Grunge influenced Alternative rock group from Escatawpa, Mississippi, United States that formed in 1996. Consisting of Brad Arnold (vocals), Chet Roberts (guitar, a replacement for Matt Roberts), Todd Harrell (bass), Chris Henderson (guitar), and Greg Upchurch (drums), the band is known for several successful rock singles such as ""Here Without You"" and ""Kryptonite"". The group signed to Universal Records in 2000.

Universal then released their first album, 'The Better Life', and they garnered a big fan response. <a href=""https://www.last.fm/music/3+Doors+Down"">Read more on Last.fm</a>","Hinder, Theory of a Deadman, Nickelback, Daughtry, Adelitas Way"
Spiritbox,24458053,350804,"Spiritbox is a Canadian alternative metal/djent band from Victoria, British Columbia, formed in 2017. Having toured the world as members of the eccentrically iconic metal band iwrestledabearonce, vocalist Courtney LaPlante (a member of IWABO since 2012) and guitarist Michael Stringer (a member since 2015) wanted to take their intensely personal and technical musical focus in a new creative and personal direction. This now-husband-and-wife team have worked extremely hard at incorporating Courtney’s sense of vocal style and lyrical quality <a href=""https://www.last.fm/music/SpiritBox"">Read more on Last.fm</a>",
LADYBABY,885542,63575,"Ladybaby is an alternative Japanese kawaii metal band. The group originally consisted of models Kuromiya Rei and Kaneko Rie, along with Ladybeard, the crossdressing persona of Australian professional wrestler Rick Magarey.

On August 1, 2016 , Ladybeard withdrew and the group re-branded itself, now going by The Idol Formerly Known As Ladybaby. 

On November 17, 2017, Kuromiya Rei left the group, citing disillusionment with idol culture and throat problems caused by the extensive touring schedule. <a href=""https://www.last.fm/music/Ladybaby"">Read more on Last.fm</a>","The Idol Formerly Known As LADYBABY, KAQRIYOTERROR, PassCode, BABYMETAL, REIRIE"
Unleash The Archers,3748490,89270,"Unleash the Archers is a Canadian heavy metal band from Victoria, BC. The band plays a fusion of traditional heavy metal with power metal and melodic death metal.

Unleash the Archers was formed in late 2007 by vocalist Brittney Hayes (a.k.a. Brittney Slayes) and drummer Scott Buchanan with former member Brayden Dyczkowski on guitar, whom Scott had played with previously in an independent death metal project. Former member Mike Selman was brought on after his departure from Canadian death metal band Meatlocker Seven. <a href=""https://www.last.fm/music/Unleash+the+Archers"">Read more on Last.fm</a>","Seven Spires, Ad Infinitum, Seven Kingdoms, Frozen Crown, Orden Ogan"
Majestica,781171,42564,"Majestica is a Swedish symphonic power metal band formed by Tommy Johansson. Formerly known as Reinxeed, they changed their name in 2019 after a five year hiatus and a new contract with Nuclear Blast. <a href=""https://www.last.fm/music/Majestica"">Read more on Last.fm</a>","ReinXeed, Twilight Force, Dragony, Terra Atlantica, Bloodbound"
Manowar,33236219,729987,"Manowar is an American heavy metal band from Auburn, New York. Formed in 1980, the group is known for lyrics based on fantasy (particularly sword and sorcery) and mythology (particularly Norse mythology and Greco-Roman mythology), as well as numerous songs celebrating the genre and its core audience. The band is also known for a loud and emphatic sound. In an interview for MTV in February 2007, bassist Joey DeMaio lamented that ""these days, there's a real lack of big, epic metal that is drenched with crushing guitars and choirs and orchestras. <a href=""https://www.last.fm/music/Manowar"">Read more on Last.fm</a>","Accept, Running Wild, Helloween, Gamma Ray, HammerFall"
Dealer,1558216,67217,"There are four bands with this name;

1) Dealer — a nu-metalcore band from Melbourne, Australia. 

2) Dealer, formed in Cirencester (UK) in 1979, were a NWOBHM band.

3) DEALER, founded in 1999, made their way through deserts, over mountains and through deep valleys, with a heart for Rock 'n' Roll and a six-string to state it.

This four-piece is rooted in several corners of Rock music. Finally the guys find themselves rockin' out like the Rolling Stones in fury, Deep Purple in anger and a bunch of Austrian shepherds on magic mushrooms. <a href=""https://www.last.fm/music/Dealer"">Read more on Last.fm</a>","Diamond Construct, Alpha Wolf, Thrown, Varials, Half Me"
Make Them Suffer,9390747,212146,"Make Them Suffer is an Australian symphonic deathcore/metalcore band from Perth, currently signed to Rise Records. The group is currently made up of: Sean Harmanis (vocals), Nick McLernon (guitar, backing vocals), Jaya Jeffery (bass), Jordan Mather (drums), and Alex Reade (vocals, keyboards).

Their debut album, Neverbloom, peaked at No. 56 on the ARIA Album charts in June 2012, while its follow up, Old Souls, debuted at No. 30 upon release in May 2015. <a href=""https://www.last.fm/music/Make+Them+Suffer"">Read more on Last.fm</a>","Currents, Alpha Wolf, Veil of Maya, Left to Suffer, Darko US"
We Came As Romans,22874300,718021,"We Came as Romans (often abbreviated as WCAR) is an American metalcore band from Troy, Michigan. Formed in 2005, the band has undergone one name change and multiple line-up changes. In 2016, they signed with SharpTone Records after being part of the Equal Vision Records roster since 2009.

The band has released six studio albums:
To Plant a Seed (2009)
Understanding What We've Grown to Be (2011)
Tracing Back Roots (2013)
We Came as Romans (2015)
Cold Like War (2017) <a href=""https://www.last.fm/music/We+Came+As+Romans"">Read more on Last.fm</a>",
Exhorder,1344928,87143,"Exhorder is an American thrash/groove metal band from New Orleans, Louisiana. They are credited as the purveyors of the groove-oriented thrash sound later made famous by bands such as Pantera, White Zombie, and Machine Head. Initially active from 1985 to 1992, they have since reformed in 2008.

Exhorder was formed in 1985 in New Orleans, Louisiana. After releasing several demos in the vein of pure thrash metal, they started to adapt more of a groove metal-oriented sound with their debut studio album, Slaughter in the Vatican, released in 1990. <a href=""https://www.last.fm/music/Exhorder"">Read more on Last.fm</a>","Atrophy, Evildead, Vio-Lence, Suicidal Angels, Demolition Hammer"
Holding Absence,7168375,196980,"Holding Absence is a rock band from Cardiff, Wales formed in 2015. The group consists of lead vocalist Lucas Woodland, guitarist Scott Carey, bassist Benjamin Elliot and drummer Ashley Green.

The band released an initial collection of singles in 2017, as well as a split EP with Loathe in 2018, before finally releasing their debut record, Holding Absence, in 2019. They are signed with SharpTone Records. In April 2021, they released their second album, 'The Greatest Mistake of My Life'. <a href=""https://www.last.fm/music/Holding+Absence"">Read more on Last.fm</a>","Caskets, Dayseeker, Thousand Below, Casey, Acres"
Electric Callboy,11994771,209794,"Electric Callboy (formerly known as Eskimo Callboy) is a German metalcore/electronicore band formed in Castrop-Rauxel in 2010. The band consists of former lead singer of To the Rats and WolvesNico Sallach, who replaced longtime lead singer Sebastian ""Sushi"" Biesler who left the band in early 2020. The rest of the band includes vocalist and keyboardist Kevin Ratajczak, the guitarists Daniel Haniß and Pascal Schillo, bassist Daniel Klossek and drummer David Friedrich. <a href=""https://www.last.fm/music/Electric+Callboy"">Read more on Last.fm</a>","Samurai Pizza Cats, To the Rats and Wolves, Eskimo Callboy, Ghøstkid, BABYMETAL, Electric Callboy"
Tungsten,587785,32823,"TUNGSTEN could refer to a number of different artists:

Tungsten is a Swedish power metal band formed by ex-HammerFall drummer Anders Johansson and his two sons.

Anders founded the band in 2016, together with his son Nick and Karl Johansson. The idea for creating a band together arose, after Anders listened to metal music that his sons created, which he enjoyed, eventually leading into the bands formation.Tungsten was later joined by Swedish vocalist Mike Andersson, following which the recording of their first album started. <a href=""https://www.last.fm/music/Tungsten"">Read more on Last.fm</a>","Bloodbound, Brothers of Metal, Dynazty, All for Metal, Dragony"
Varials,2751223,144320,"Varials is an American metalcore band from Philadelphia, Pennsylvania, formed in October 2013. The band currently consists of guitarist/Lead Vocalist Mitchell Rogers, guitarist James Hohenwarter, bassist Mike Foley and drummer Sean Rauchut. Their first release was the single ""Trapped"", released on October 7, 2013. They released an EP, Recollection in 2014. In 2015, they released the EP Failure//Control. In 2016, they released a split EP, Absolution with Wilmington, Delaware based band Vicious Embrace. <a href=""https://www.last.fm/music/Varials"">Read more on Last.fm</a>","Boundaries, Bodysnatcher, Kublai Khan TX, Traitors, Dealer"
Leprous,15262098,178761,"Leprous is a progressive metal band from Notodden, Norway, home of bands such as Emperor, Zyklon, Ihsahn, CIrcus Maximus, and many more.

Since Leprous was founded in 2001, they've gone through a few changes in the line-up, and now consists of Einar Solberg (synth/vocals), Tor Oddmund Suhrke (guitar), Simen Børven (bass), Robin Ognedal (guitar) and Baard Kolstad (drums)

The young quintet have already made themselves visible on the Norwegian prog- and metal scene, and twice the band has made the finals in the Norwegian Rock Championship. <a href=""https://www.last.fm/music/Leprous"">Read more on Last.fm</a>","Haken, Caligula's Horse, VOLA, Pain of Salvation, TesseracT"
Dream Theater,116319035,1253934,"Dream Theater is an American progressive metal band formed in 1985 under the name Majesty by John Petrucci, John Myung and Mike Portnoy while they attended Berklee College of Music in Boston, Massachusetts. They subsequently dropped out of their studies to concentrate further on the band that would eventually become Dream Theater. Their current lineup consists of Petrucci, Myung, vocalist James LaBrie, keyboardist Jordan Rudess and drummer Mike Portnoy. <a href=""https://www.last.fm/music/Dream+Theater"">Read more on Last.fm</a>","Liquid Tension Experiment, John Petrucci, Symphony X, Haken, James LaBrie"
Equilibrium,14639629,288911,"At least five bands share the name ""Equilibrium"":

1. Equilibrium is a metal band from Munich, Germany, founded in 2001. They released a very positively acclaimed demo at the beginning of 2003, which brought them a record deal with the label Black Attakk. Their debut, Turis Fratyr, was released on February 15, 2005. In October 2006 they signed with Nuclear Blast.  They recorded their new album 'Sagas' in January 2007. The album was made available worldwide on July 8, 2008. <a href=""https://www.last.fm/music/Equilibrium"">Read more on Last.fm</a>","Ensiferum, Finntroll, Brymir, Finsterforst, Svartsot"
Crystal Lake,4371213,160343,"There are multiple acts called Crystal Lake.
1)  Japanese metal band from Tokyo
2) A hardstyle duo.
3) Polish progressive rock/metal band
4) Brazilian thrash metal band
5) Dutch thrash metal band, later renamed to Crustacean
6) Hip-hop group from Huddersfield, UK. Released first EP under this name in 1999, then later albums in 2006 and 2011.

1) Crystal Lake is a Japanese djent band from Tokyo, formed in 2002. The band comprises guitarist Yudai Miyamoto and vocalist Ryo Kinoshita with support of bassist Mitsuru and drummer Gaku Taura <a href=""https://www.last.fm/music/Crystal+Lake"">Read more on Last.fm</a>","Knosis, Crossfaith, Fit For A King, Currents, Aviana"
Russian Circles,16620149,475578,"Russian Circles is a post-metal band from Chicago, USA. The band plays epic, sprawling music which runs the gamut of heavy discordant metal to soft delicate passages. They are also known for their energetic live shows, having toured with Isis, Tool, Red Sparowes, Pelican, Minus the Bear, Daughters, amongst various others. They have also taken part in the 2006, 2007 & 2008 SXSW festivals.

Formed in late 2004 by guitarist Mike Sullivan and bassist Colin DeKuiper (both formerly of another instrumental band Dakota/Dakota) <a href=""https://www.last.fm/music/Russian+Circles"">Read more on Last.fm</a>","Pelican, If These Trees Could Talk, Red Sparowes, pg.lost, Caspian"
Upon A Burning Body,4319098,167887,"Upon a Burning Body is an American metal band from San Antonio, Texas, formed in 2005. The band currently consists of vocalist Danny Leal, guitarists Sal Dominguez and Ruben Alvarez and bassist Rey Martinez. Their second studio album, Red. White. Green., debuted at No. 105 on the Billboard 200 in 2012. Their third and latest album, The World Is My Enemy Now, was released on 12 August 2014. The band is currently signed to Sumerian Records.



Current members <a href=""https://www.last.fm/music/Upon+a+Burning+Body"">Read more on Last.fm</a>","Attila, Bleed from Within, Left to Suffer, Spite, Fit For A King"
Any Given Day,1812706,86621,"Any Given Day is a German metalcore band formed in 2012 in Gelsenkirchen.

The band was formed in 2012 by singer Dennis Diehl, guitarists Andy Posdziech and Dennis ter Schmitten, bassist Michael Golinski and drummer Raphael Altmann who played in several bands before forming Any Given Day.

In October 2012 they recorded a three-track self-titled demo. All three songs were re-recorded on their debut album My Longest Way Home, which was released worldwide in September 2014 via Redfield Records. <a href=""https://www.last.fm/music/Any+Given+Day"">Read more on Last.fm</a>","Annisokay, Bury Tomorrow, Light the Torch, Kill the Lights, Sight Unscene"
Issues,8298718,201963,"Issues was an experimental metalcore/post-hardcore band with contemporary R&B elements from Atlanta, Georgia, United States. They formed in the summer of 2012 and were signed to Rise Records shortly after their formation. The majority of the band's members originated from Woe, Is Me.

In November 2023, the remaining members announced the band was finished and would play three farewell shows in 2024.

Issues consisted of:
Adrian ""AJ"" Rebollo - Guitar, Backup Vocals <a href=""https://www.last.fm/music/Issues"">Read more on Last.fm</a>","Woe, Is Me, Emarosa, I See Stars, Slaves, Bilmuri"
Wheel,1150156,64746,"There are at least two artists who have recorded under the name Wheel. 
1) Progressive rock/metal band from Helsinki, Uusimaa, Finland. 
2) Doom metal band from Dortmund, North Rhine-Westphalia, Germany. 

1) Wheel is a Finnish prog-metal band based in Helsinki, consisting of James Lascelles (Vocals/Guitar), Santeri Saksala (Drums) and Jussi Turunen (Lead Guitar).

Since 2017, the band has released 3 EPs and 2 albums and their third album, ‘Charismatic Leaders’ will come out on May 3rd. <a href=""https://www.last.fm/music/Wheel"">Read more on Last.fm</a>","VOLA, Caligula's Horse, Vulkan, Leprous, Haken"
Ankor,843529,44018,"Ankor is an alternative metal band based in Catalonia (Spain) with female front singer/screamer Jessie Williams (Bristol, UK), female drummer Eleni Nota (Rhodes, Greece), guitarist/singers David Romeu, Fito Martinez and bassist Julio López (Tarragona, Catalonia) formed in 2003 in ‘Els Pallaresos’ a small village near Barcelona, when its members were only around 14 years old. More than 15 years later, with 5 albums on their backs and spread worldwide, Ankor is a national reference in Spain. <a href=""https://www.last.fm/music/Ankor"">Read more on Last.fm</a>","Conquer Divide, Venues, Beyond the Black, Infected Rain, Ad Infinitum"
Demons & Wizards,7187777,269813,"Demons & Wizards was a power metal band conceived as a side-project by Blind Guardian vocalist Hansi Kürsch and Jon Schaffer, the guitarist for Iced Earth. Schaffer wrote the music and Kürsch wrote the lyrics. The band's line-up during the recording of their first album in 1999 (Demons & Wizards) featured Mark Prator, who was the drummer on a few Iced Earth albums, and Jim Morris, who has engineered for Iced Earth before, on lead guitar. The personnel for the second album (Touched by the Crimson King) <a href=""https://www.last.fm/music/Demons+&+Wizards"">Read more on Last.fm</a>","Blind Guardian, Iced Earth, Edguy, Gamma Ray, Avantasia"
José Andrëa,126804,10756,"José Martinez Arroyo is the vocalist of the Spanish folk rock/metal band Mägo de Oz. He was born in La Paz, Bolivia on June 2nd in 1971, and lives in Spain. He is married and has a daughter, his pseudonym 'Andrëa' comes from her name.  

'Donde el corazón te lleve' is his first solo album, relased in 2004. It contains various cover versions of well known rock songs. All of them got new Spanish lyrics, written by Txus (Mägo de Oz), except 'Siempre estás allí' which is a song by Baron Rojo and 'Donde el corazón te lleve' <a href=""https://www.last.fm/music/+noredirect/Jos%C3%A9+Andr%C3%ABa"">Read more on Last.fm</a>","Ars Amandi, Ankhara, LUJURIA, José Andrëa y Uróboros, Darksun"
The Dark Element,736923,29511,"The Dark Element is a project fronted by former Nightwish vocalist Anette Olzon together with Finnish guitarist and songwriter Jani Liimatainen, formerly of Sonata Arctica and currently of Insomnium. 

The project have released two albums - The Dark Element in 2017, and Songs The Night Sings in 2019. <a href=""https://www.last.fm/music/The+Dark+Element"">Read more on Last.fm</a>","Beyond the Black, Anette Olzon, Metalite, Moonlight Haze, Battle Beast"
Horizon Ignited,364004,27799,"Finnish melodic death metal band 'HORIZON IGNITED' have officially joined the biggest metal label in the world, Nuclear Blast Records.  Over the past thirty frantic years, this passion-raising heavy metal subgenre has undeniably evolved and changed, but some complaints have also been heard in the dim alleys: where are all the magnificent entrants?
Well, as so many times before, kindly turn your face towards Finland − still the most metallic country in the world − and meet melodic death metal's hottest newcomers. <a href=""https://www.last.fm/music/Horizon+Ignited"">Read more on Last.fm</a>","Eye of the Enemy, Words of Farewell, Parasite Inc., Bloodred Hourglass, The Halo Effect"
After The Burial,9359437,220202,"An influential American metalcore outfit, After the Burial emerged in the mid-2000s with an innovative sound that paired technical acumen with sonic malevolence. Since debuting in 2006 with Forging a Future Self, the band has endured numerous lineup changes, with lead guitarist and co-founder Trent Hafdahl serving as the sole consistent member. Since their debut, ATB have had a string of successful albums including In Dreams (2010), Dig Deep (2016) <a href=""https://www.last.fm/music/After+the+Burial"">Read more on Last.fm</a>","Born of Osiris, Veil of Maya, Volumes, Within the Ruins, ERRA"
Tygers Of Pan Tang,1410981,89218,"Tygers of Pan Tang is a New Wave Of British Heavy Metal band originating from Whitley Bay in the North-East of England. The band was originally formed by Robb Weir (guitar) Brian Dick (drums) Rocky (real name Richard Laws - bass) and Jess Cox (vocals). Rapidly building a local following, they were first signed up by local independent label Neat Records before MCA gave them a major record deal and released their first album ""Wild Cat"" in 1980. Subsequently John Sykes was added as second guitarist. <a href=""https://www.last.fm/music/Tygers+of+Pan+Tang"">Read more on Last.fm</a>","Raven, Praying Mantis, Samson, Saxon, Diamond Head"
A Day To Remember,119962175,1695094,"A Day to Remember is a band from Ocala, Florida, founded in 2003 by guitarist Tom Denney and drummer Bobby Scruggs. They are mainly known for their unusual amalgamation of metalcore and pop punk as a musical style, as well as playing other styles. The band consists of vocalist Jeremy McKinnon, rhythm guitarist and backing vocalist Neil Westfall, bassist Joshua Woodard, percussion and drummer Alex Shelnutt and lead guitarist Kevin Skaff.

Signing with Indianola for their first album <a href=""https://www.last.fm/music/A+Day+to+Remember"">Read more on Last.fm</a>","Beartooth, Silverstein, We Came as Romans, Four Year Strong, Of Mice & Men"
The Devil Wears Prada,39447643,773827,"The Devil Wears Prada is a metalcore band from Dayton, Ohio, formed in 2005. The band members include Mike Hranica (lead vocals, additional guitars), Jeremy DePoyster (rhythm guitar, vocals), Kyle Sipress (lead guitar, backing vocals), Jonathan Gering (keyboards, synthesizers, programming, backing vocals), Giuseppe Capolupo (drums), and Mason Nagy (bass). Former members include James Baney (keyboards, synthesizers, programming), Chris Rubey (lead guitar <a href=""https://www.last.fm/music/The+Devil+Wears+Prada"">Read more on Last.fm</a>","Like Moths to Flames, Fit For A King, Silent Planet, Currents, The Plot in You"
Knocked Loose,23677974,336924,"Knocked Loose is an American metalcore band from Oldham County, Kentucky, formed in 2013 and currently signed to Pure Noise Records. The band as of 2020 is Bryan Garris (lead vocals), Nicko Calderon (rhythm guitar), Isaac Hale (lead guitar & backing vocals), Kevin Otten (bass), and Kevin Kaine (drums).  Former members include Cole Crutchfield (2015–2020)  (rhythm guitar & backing vocals).

The band released their first studio album, Laugh Tracks <a href=""https://www.last.fm/music/Knocked+Loose"">Read more on Last.fm</a>","Kublai Khan TX, Boundaries, Dying Wish, Alpha Wolf, Knocked Loose, Poppy"
Whitechapel,20232816,396832,"There are multiple artists with this name:

1)Whitechapel is an American deathcore band from Knoxville, Tennessee. The band is named after the Whitechapel district in East London, England, referencing the series of murders committed by Jack the Ripper. The group comprises vocalist Phil Bozeman, guitarists Ben Savage, Alex Wade, and Zach Householder, bassist Gabe Crisp, and drummer Ben Harclerode. Founded in 2006 by Bozeman and Savage, the band has released six studio albums, eleven music videos and are currently signed to Metal Blade Records. <a href=""https://www.last.fm/music/Whitechapel"">Read more on Last.fm</a>","Thy Art Is Murder, Fit for an Autopsy, Chelsea Grin, Suicide Silence, Signs of the Swarm"
Massimo Pericolo,2867432,42422,"There are at least two artists sharing the name Massimo Pericolo: 1) an Italian rapper  2) a Costa Rican prog rock artist

1) Massimo Pericolo, nome d'arte di Alessandro Vanetti (Gallarate, 30 novembre 1992), è un rapper italiano.

Nato a Gallarate e cresciuto tra Malgesso, Treviso, Catania e nuovamente Gavirate, si avvicina al rap a 11 anni grazie al film 8 mile di Eminem. Ispirato dal film scriverà i suoi primi testi provando a ricreare le battle di freestyle del film con i suoi amici. <a href=""https://www.last.fm/music/Massimo+Pericolo"">Read more on Last.fm</a>","TEDUA, Sfera Ebbasta, Gemitaiz, Marracash, Kid Yugi"
Onslaught,2287461,116901,"Onslaught is a British thrash metal band from Bristol, England, active from 1982 to 1991 and again since 2005. The band initially drew influences from US and British hardcore punk bands such as Discharge and The Exploited, as well as the new wave of British heavy metal, and eventually adopted a straightforward thrash metal sound. They have been recognised as pioneers of the British thrash metal scene, and are often referred to as one of the country's so-called ""big four"", along with Sabbat, Xentrix and Acid Reign. <a href=""https://www.last.fm/music/Onslaught"">Read more on Last.fm</a>","Exumer, Exodus, Tankard, Overkill, Destruction"
