Artista,Reproducciones,Oyentes,Biografía,Artistas_Similares
Mugshot,634600,66383,"There are more bands with this name:

1. Put aside the vintage t-shirts; strip away the labels and signifiers; dont mind the school-boy looks and tattoos. Just listen to the catchy, inescapable pop-ridden music of Mugshot. Their simple goal is to write great pop songs with dashes of current punk. 

Mugshot have put in over 7 years of relentless independent touring, recording and living. Selling over 2000 copies of their Get Well Soon EP, touring all over North America with some big bands and some small bands <a href=""https://www.last.fm/music/Mugshot"">Read more on Last.fm</a>","X-Ile, Distinguisher, Fox Lake, God Complex, Kublai Khan TX"
The Quireboys,879395,75187,"Originally known as The Queerboys, The Quireboys, known in the U.S. as the London Quireboys (even though they come from Newcastle), are a hard rock band that started in the late '80s/early '90s, getting that moniker from the 1977 comedy film of the same name. With John Grey (""Spike"") on vocals, Guy Griffin and Guy Bailey on guitar, Chris Johnstone on piano/keyboard, Nigel Mogg on bass guitar, and Ian Wallace on drums, the guys are best known for their 1990 hit album 'A Bit of What You Fancy'. <a href=""https://www.last.fm/music/The+Quireboys"">Read more on Last.fm</a>","Massive Wagons, Thunder, Gun, The Dead Daisies, Michael Monroe"
Akash,149197,11867,"There are two artists with the name Akash.

1: Akash is a rock band born in Armenia,quindio, Colombia.

 
2: Akash is a Pakistani band, making Pakistani pop, including music for Bollywood movies. : 
AKASH came into being in 2001, some six years ago. It was however, three years ago that the band`s line up was finalized. During these three years the band decided not to release any audios and concentrated solely on improving and polishing their musical abilities, at the same time gaining confidence as they saw themselves and their music grew. <a href=""https://www.last.fm/music/Akash"">Read more on Last.fm</a>","Krönös, Leo Jiménez, Bajo Sueños, Angeles del Infierno, Sangre Azul"
KAQRIYOTERROR,570103,30123,"KAQRIYOTERROR, previously known as  幽世テロルArchitect (Kaqriyo Terror Architect), is an idol group formed in August 2017, under the label codomomental.

NOTE: Please use the artist tag 幽世テロルArchitect for music released prior to the lilithpride single.

Members
Komari Yuu (心鞠游) 2018-present
Noa Rondo (ノア・ロンド) 2019-present
Nonamera (のなめら) 2017-2019; 2022-present
RЯ (ありゃ) 2022-present
Sumomo (季 / すもも) 2018-present (currently on hiatus) <a href=""https://www.last.fm/music/KAQRIYOTERROR"">Read more on Last.fm</a>","Ladybaby, FRUITPOCHETTE, MIGMA SHELTER, PassCode, DOLL$BOXX"
SABER TIGER,160822,5155,"There are various artists that go by the name of Saber Tiger.

1) Saber Tiger was formed by guitarist Akihito Kinoshita and the Iwai brothers in 1981. After releasing three albums through an independent record label, the band had a temporary break-up. However, Kinoshita worked around this and signed a major label contract with Tokuma Japan Communications. Saber Tiger's 1997 major debut album, 'Project One', thrust the band to the front of the flourishing Japanese metal scene. <a href=""https://www.last.fm/music/Saber+Tiger"">Read more on Last.fm</a>","Double Dealer, Naoya Mori, Vow Wow, Flatbacker, Blindman"
Left to Suffer,1257593,75753,"Left to Suffer is a deathcore band hailing from Atlanta, United States. The band was formed in 2019 and is currently signed to BVTV Music. The band consists of Taylor Barber on vocals, Peter Higgs and Jacob Gordon on guitars, Christian Nowatzki on bass, and Levi Dunn on drums.

The band is drawing inspiration from contemporaries such as Lorna Shore, Traitors, and Bodysnatcher. Left to Suffer combines influences from various corners of the deathcore genre, resulting in a distinct and unique sound called ""Nu Deathcore"". <a href=""https://www.last.fm/music/Left+to+Suffer"">Read more on Last.fm</a>","Brand of Sacrifice, To the Grave, PALEFACE SWISS, Signs of the Swarm, Traitors"
Serj Tankian,35590289,978662,"Serj Tankian (born August 21, 1967 in Beirut, Lebanon) is an Armenian-American singer. He started as a singer in the alternative metal band System of A Down and after they went on hiatus he continued his career as a solo artist and producer. He is known for his gritty yet wide vocal range. His solo output mixes various styles and genres, including metal, rock and Armenian musical motifs.

At age five, Serj Tankian moved with his parents to Los Angeles, California. <a href=""https://www.last.fm/music/Serj+Tankian"">Read more on Last.fm</a>","Daron Malakian and Scars on Broadway, Scars on Broadway, System of a Down, Viza, Hypnogaja"
Betraying The Martyrs,4215909,154973,"Betraying the Martyrs is a French deathcore band. With a new and refreshing attitude to modern metal that is certain to take the music scene by storm. The original line up, established in December 2008 consisted of a group of open minded individuals, whose only goal was to write punishing tracks, deliver an astounding live performance and portray a good image with a new message of positive thinking and good morals. Their first track was recorded in February 2009 in Paris by famous metal producer Stéphane Buriez (Loudblast). <a href=""https://www.last.fm/music/Betraying+the+Martyrs"">Read more on Last.fm</a>","Breakdown of Sanity, Bleed from Within, The Browning, Fit For A King, Any Given Day"
God Complex,702286,59924,"There are multiple bands with this name :

1) A hardcore metal band from Merseyside, UK formed in 2017, disbanded in 2021 and re-formed in 2024. Their 'Created Sick' EP was released in 2018.

2) An underground hip hop group. Original name for the collaboration of 7L & Esoteric, up until around 1997 when they started going under the self titled group name, 7L & Esoteric. Also consisting MC Karma, who is a manager for Indie Hip Hop label, Brick Records. <a href=""https://www.last.fm/music/God+Complex"">Read more on Last.fm</a>","Bloodbather, Distinguisher, fromjoy, 156/Silence, Mugshot"
Bloodred Hourglass,1514252,45942,"Bloodred Hourglass, also known as “BRHG”, is a metal band from a small & cold city of Mikkeli, located in the eastern part of Finland. Originally formed in 2005 by Hyvönen (drums) & Koukonen (vocals), and soon joined by bass-player Moilanen and guitarists Nenonen and Tiilikainen, Bloodred Hourglass quickly gathered the knowledge of Finnish metalheads by a few self-released demos and fairly decent amount of gigs played as a non-labeled act. After six years of consistently working on music and destroying the audiences <a href=""https://www.last.fm/music/Bloodred+Hourglass"">Read more on Last.fm</a>","I Am Your God, Eye of the Enemy, The Halo Effect, Before the Dawn, Mors Principium Est"
Running Wild,10286625,259096,"Running Wild is a German heavy metal band formed in Hamburg in 1976. They were part of the German metal scene to emerge in the early to mid-1980s, and are also considered to be one of the country's so-called ""big four"" of power metal, along with Grave Digger, Helloween and Rage. Over the course of their career, they have released 17 studio albums, three live albums, five compilation albums, and six singles/EPs.

Although their earlier releases contained Satanic themes and imagery <a href=""https://www.last.fm/music/Running+Wild"">Read more on Last.fm</a>","Grave Digger, Gamma Ray, Blazon Stone, U.D.O., Manilla Road"
Warlord,614328,30355,"There are at least 7 artists named Warlord:
1) 80s Power Metal
2) 90s Doomcore (sludge?)
3) 90s-00s Chip/Demoscene/Metal musician
4) 70s Doom Metal/Heavy Psych
5) Rock band from UK. 
6) Rapper
7) British RAC band
8) An NSBM project from the USA, formed by Werewolf SS.

1) Warlord is one of those little known bands who should have earned much more fame. Their first album ""Deliver us"" was published in the early '80s (1983) and it was enough, along with ""And The Cannons Of Destruction Have Begun"" that followed with only few more new songs <a href=""https://www.last.fm/music/Warlord"">Read more on Last.fm</a>","Ostrogoth, Omen, Cloven Hoof, Crimson Glory, Manilla Road"
Love and Death,1590368,55636,"Love and Death is a Christian nu metal band formed by former Korn guitarist Brian ""Head"" Welch. The group was officially announced in February 2012 as a re-branding of Welch's solo music project.

The group is effectively a re-branding of the touring group that performed under Welch's name to promote his solo album. Formed in 2009, Welch recruited musicians through open auditions via YouTube, and second-round auditions, in person, at his studio in Phoenix, Arizona. <a href=""https://www.last.fm/music/Love+and+Death"">Read more on Last.fm</a>","Brian Welch, Head, Chaoseum, Demon Hunter, Ill Niño"
Amenra,6159463,136718,"Amenra is a Belgian post-metal band from Kortrijk, Belgium, formed in 1999. The band was founded by vocalist Colin H. van Eeckhout and lead guitarist Mathieu van de Kerckhove. The two had been in the band Spineless and wanted to create music with more ""heart and soul"". Their name connects the biblical amen with the Egyptian god Ra. They are known for a brooding and unique sound as well as intense live performances. Colin is noted for exclusively singing his vocals with his back turned towards the audience <a href=""https://www.last.fm/music/Amenra"">Read more on Last.fm</a>","Cult of Luna, Absent In Body, Latitudes, Year of No Light, Rosetta"
Kanonenfieber,1162626,31975,"Kanonenfieber is a blackened death metal band from Bamberg, Germany. Their debut album 'Menschenmühle' was released on February 20th 2021, and is intended to commemorate the countless victims of World War I.

Behind Kanonenfieber is a young musician from Bamberg who calls himself 'Noise' (Non Est Deus, Leiþa) and deliberately keeps the project anonymous. He lives off a regular 40-hour job, but his passion is music. He devotes most of his free time to this. <a href=""https://www.last.fm/music/Kanonenfieber"">Read more on Last.fm</a>","1914, Non Est Deus, Groza, Leipa, Minenwerfer"
Crematory,6929686,185669,"There are at least two bands, who share the name ""Crematory"".

1) A German Death Metal (early), Gothic Metal band formed in Mannheim, Baden-Württemberg, Germany in 1992.
The German Crematory broke up in 2001 and reformed in 2003 to release the album Revolution, a largely progressive effort which brought the band into more accessible/techno-metal territory than ever before.
Their sound has often been compared to early-Sentenced, Fear Factory, and Dark Tranquillity. <a href=""https://www.last.fm/music/Crematory"">Read more on Last.fm</a>","Dark the Suns, Darkseed, Lake of Tears, Graveworm, Beseech"
Chevelle,40990980,1429129,"Chevelle are an alternative metal band from Grayslake, IL. They formed in 1994 with the members of Sam Loeffler, Pete Loeffler (brothers) and Matt Scott. Matt was later replaced in 1996 by Joe Loeffler as bass player. On July 10, 2005 Joe was fired because of ""irreconcilable differences"". Geno Lenardo (Filter) filled in until August 2005, when Dean Bernardini (brother-in-law to the Loefflers) became the new bass player of Chevelle. 

 	Inspired by the lurching riffs of Helmet and the soft/loud vocal styling of Tool <a href=""https://www.last.fm/music/Chevelle"">Read more on Last.fm</a>","10 Years, Staind, Seether, Breaking Benjamin, Crossfade"
Silent Planet,7528933,118964,"Silent Planet is an American metalcore band from Los Angeles, California, formed in 2009. Their name is a nod to C. S. Lewis' science-fiction novel Out of the Silent Planet. The group currently consists of vocalist Garrett Russell, guitarist Mitchell Stark, bassist Thomas Freckleton and drummer Alex Camarena.  The band is currently signed to Solid State Records, and have recorded a total of two EPs and five full-length albums to date: The Night God Slept (2014) <a href=""https://www.last.fm/music/Silent+Planet"">Read more on Last.fm</a>","Invent Animate, Northlane, Currents, Polaris, Thornhill"
Jorn,3940144,128575,"There is more than one Jorn:

1) JORN is the solo project of the vocalist Jørn Lande.

Currently the band are:

Jørn Lande: Vocals
Trond Holter: Guitar
Willy Bendiksen: Drums
Thomas Bekkevold: Bass

Discography:
2000 - Starfire
2001 - Worldchanger
2004 - Out to every Nation
2006 - The Duke
2007 - The Gathering (compilation)
2007 - Unlocking the Past (cover album)
2008 - Lonely Are The Brave
2010 - Dio (cover album)
2012 - Bring Heavy Rock To The Land <a href=""https://www.last.fm/music/Jorn"">Read more on Last.fm</a>","Masterplan, Allen-Lande, The Ferrymen, Axel Rudi Pell, Gotthard"
Massacre,2434799,92290,"There are multiple bands with the same name. Here they are listed in chronological order:

- (1) An American Death Metal band from Tampa, FL, initially formed in 1984.
- (2) Free Improvisation/Experimental band from New York formed in 1980 by Fred Frith Of Henry Cow.
- (3) A pioneering skate rock band from Argentina, formed in 1985.
- (4) A Finnish punk band formed in 1983

(1) Although Massacre were hampered by unstable line-ups for much of their career <a href=""https://www.last.fm/music/Massacre"">Read more on Last.fm</a>","Benediction, Malevolent Creation, Cancer, Grave, Asphyx"
Volumes,6443884,178532,"Volumes is an American djent band from Los Angeles, California formed in 2009. 
Current members: Michael Barr - vocals, Myke Terry - vocals, Raad Soudani - bass, Nick Ursich - drums.
Former members: Diego Farias (RIP), Gus Farias, Daniel Schwartz, Chris Khoury, Daniel Braunstein. 

The band started in 2009 when guitarists Diego Farias and Daniel Braunstein were writing music together. Singers Michael Barr and Diego's brother, Gus Farias, joined the band along with Raad Soudani on bass and Chris Khoury playing the drums. <a href=""https://www.last.fm/music/Volumes"">Read more on Last.fm</a>","ERRA, Northlane, Structures, Invent Animate, Monuments"
Liquid Tension Experiment,6046409,286584,"Liquid Tension Experiment is an instrumental progressive rock/metal project consisting of Dream Theater members John Petrucci (guitar), Jordan Rudess (keyboard), and Mike Portnoy (drums), as well as progressive rock icon Tony Levin (bass, Chapman stick) of King Crimson. The combo was formed as a side project to Dream Theater in 1997. Rudess was asked to join Dream Theater largely because of the success of the Liquid Tension Experiment; Mike Portnoy <a href=""https://www.last.fm/music/Liquid+Tension+Experiment"">Read more on Last.fm</a>","Dream Theater, John Petrucci, Transatlantic, Sons of Apollo, Jordan Rudess"
Manntra,701743,29192,"Malice and Zoltan from Omega Lithium have a new project called MANNTRA. They released the first single ""KIŠA"" (eng ""RAIN"")! They are preparing something very unique! Show them your support by LIKING the page and sharing! 
http://www.facebook.com/pages/Manntra/289410634405796
http://www.youtube.com/ManntraTV 
http://www.manntra.hr/ <a href=""https://www.last.fm/music/Manntra"">Read more on Last.fm</a>","Sturmmann, Harpyie, Woodscream, Stahlmann, Saltatio Mortis"
Resolve,1205826,52771,"There is more than one band named Resolve:

1. Resolve is a metalcore band from Lyon, France. They are currently signed to Arising Empire.

2. ""Resolve is a five-piece straight edge band from the St. Louis, MO-area, that plays pure late 1980s youthcrew hardcore, in the classic style that bands like Youth Of Today and Turning Point made big. So the perfect soundtrack to singalong, fingerpoint and jump around to! The songs are fast, energetic full of catchy singalongs and deal with life from a positive perspective. <a href=""https://www.last.fm/music/Resolve"">Read more on Last.fm</a>","LANDMVRKS, Kingdom of Giants, Hollow Front, Silent Planet, Novelists"
Hypocrisy,18151381,300493,"Hypocrisy is a Swedish death metal band formed in October 1991 in Ludvika by Peter Tägtgren. After spending three years in Fort Lauderdale, Florida, in 1990, founder Peter Tägtgren returned to his homeland of Sweden, to form his own band. Hypocrisy's early releases were noted as being well-executed death metal, but panned for not being particularly innovative. That criticism waned as the band matured, cultivating a more distinctive sound as well as employing an introspective lyrical approach. <a href=""https://www.last.fm/music/Hypocrisy"">Read more on Last.fm</a>","Bloodbath, Kataklysm, Dismember, At the Gates, Vader"
Unfound Reliance,69869,13172,"Swedish melodic death metal band Unfound Reliance describe themselves as “First Aid Kit but with Metal guitars”. A peculiar self-portrayal for a metal act combining introspective, at times melancholic lyrics with a passion for melody that draws inspiration from the Gothenburg sound pioneers.

Rather than aiming at misanthropic individualism, their inward-looking messages are carefully balanced with the idea of togetherness: In the face of adversity, we humans have better chances of surviving if we unite. <a href=""https://www.last.fm/music/Unfound+Reliance"">Read more on Last.fm</a>","Among Your Gods, Deals Death, I Am Your God, Eye of the Enemy, Fighting the Phoenix"
Karnivool,11124702,234289,"Karnivool is an alternative rock/progressive rock group based in Perth, Australia that was formed by Ian Kenny in 1996, who at the time filled the roles of both guitarist and vocalist for the band while they played Carcass and Nirvana covers. Their name stems from the band being initially described by local fans as ""a bunch of clowns"". Their style of music can be classified as both progressive rock and alternative rock, with alternative metal undertones. <a href=""https://www.last.fm/music/Karnivool"">Read more on Last.fm</a>","Dead Letter Circus, Cog, Rishloo, Caligula's Horse, The Butterfly Effect"
Melvins,22915715,627504,"Melvins is a sludge metal band that formed in Montesano, Washington, United States in 1983. The band currently consists of Buzz Osborne (vocals, guitar), Steven Shane McDonald (bass), and Dale Crover (drums). Osborne is the only remaining original member, although Crover has been a member since early in the band's career.

In the early days of their career. . . their dark, heavy, oppressively slow sound made them innovators of genres like sludge, grunge, and doom metal. <a href=""https://www.last.fm/music/Melvins"">Read more on Last.fm</a>","Big Business, Melvins & Lustmord, Eyehategod, Sleep, Fudge Tunnel"
Machinae Supremacy,22263350,239575,"Machinae Supremacy is a metal band from Luleå, Sweden. Their musical style is based on the use of the Sidstation synthesizer, which incorporates the SID (Sound Interface Device) of the Commodore 64 home computer. The retro-electronic sound is blended with a metal sound to produce a special kind of ""SID-metal"" . Their album Redeemer (released March 18th, 2006 as an 'Underground Edition'), was described by the band in an interview as everything DXM (Deus Ex Machinae, the debut album) wasn't. <a href=""https://www.last.fm/music/Machinae+Supremacy"">Read more on Last.fm</a>","Amaranthe, DEgITx, Arion, Metalite, Volturian"
BLACKSHAPE,184397,20836,"BLACKSHAPE is an instrumental, post-mathcore band from Salt Lake City, UT. Their forthcoming debut album, recorded and co-produced by the legendary Matt Goldman (The Chariot, Underoath, Silent Planet), is a study in maximalism—written and recorded as one continuous loop, the record plunges listeners into a complex journey of heavy, beautiful math. <a href=""https://www.last.fm/music/Blackshape"">Read more on Last.fm</a>","Shy, Low, Carved Into The Sun, If These Trees Could Talk, Pijn, Holy Fawn"
Burning Point,341765,20884,"BURNING POINT was founded in the Fall of 1999 in Oulu, Finland. After the recordings of only one promotional CD, the band managed to get a record deal with a well-known German based metal label, Limb Music (LMP), who released the albums ""Salvation By Fire"" (2001) and ""Feeding The Flames"" (2003). Despite massive legal problems which ended up in fights through lawyers and the loss of their record deal, the band managed to get live slots on some big festivals such as Tuska Metal Festival and Sweden Rock. <a href=""https://www.last.fm/music/Burning+Point"">Read more on Last.fm</a>","Serious Black, Frozen Land, Guardians of Time, Excalion, Cryonic Temple"
Darko US,4040785,71347,"Darko US is a duo project formed in 2020, comprised of multi-instrumentalist/producer Josh Miller (ex- Spite, ex- Emmure) and Chelsea Grin vocalist Tom Barber (ex-Lorna Shore). As of 2024, They have released 3 studio albums and 2 EPs.

2020 - Pt. 1 Dethmask (EP)
2021 - Darko
2022 - Oni
2022 - Dethmask, Pt. 2 (EP)
2024 - Starfire <a href=""https://www.last.fm/music/Darko+US"">Read more on Last.fm</a>","ten56., Chelsea Grin, Alpha Wolf, Brand of Sacrifice, To the Grave"
Snuffed on Sight,988030,41381,"Snuffed on Sight is a slam death metal band signed to Barbaric Brutality. They have been making music since 2020 in San Francisco, California.

Current Lineup:

Seven Kane - Vocals
Kendric DiStefano - Drums
Walid Gad - Guitars
Spencer Metala - Bass <a href=""https://www.last.fm/music/Snuffed+on+Sight"">Read more on Last.fm</a>","PEELINGFLESH, Bodybox, 10 TO THE CHEST, Sanguisugabogg, Corpse Pile"
Pappo,551756,52012,"Pappo (Buenos Aires, March 10th, 1950 - Luján, Buenos Aires province, February 24th, 2005), born Norberto Napolitano, is definitely one of the most relevant icons on the heavy rock and blues mainstream of over the last 30 years in Argentina's musical showbiz, if not the one and only representative guitarist/songwriter of the genre all across South America.

A native of the middle-class La Paternal neighborhood in Buenos Aires, Pappo started playing the guitar at the age of ten <a href=""https://www.last.fm/music/Pappo"">Read more on Last.fm</a>","Pappo's Blues, La Renga, Divididos, Riff, Ratones Paranoicos"
Orange Goblin,5690457,218625,"Orange Goblin, previously Our Haunted Kingdom, are a stoner metal band from London, United Kingdom that formed in 1995. The band's lineup currently consists of singer Ben Ward, guitarist Joe Hoare, bassist Martyn Millard, and drummer Chris Turner.

The band was originally formed in 1995 under the name Our Haunted Kingdom. They released a split 7"" with Electric Wizard in 1996 on Rise Above Records before adopting the moniker Orange Goblin. The band's first three albums were stoner/doom metal. <a href=""https://www.last.fm/music/Orange+Goblin"">Read more on Last.fm</a>","Fu Manchu, Red Fang, Greenleaf, 1000mods, High on Fire"
Elwood Stray,491602,40719,"Elwood Stray is a post-hardcore band from Essen, Germany and was formed in 2016. They gained national and europe-wide attention after their release of their debut album Gone With The Flow in summer of 2023. As of now they played shows with bands like Chaosbay, Rise of the Northstar and Stick to Your Guns. <a href=""https://www.last.fm/music/Elwood+Stray"">Read more on Last.fm</a>","The Narrator, Downswing, Our Promise, Howl Like Wolves, Bad/Love"
Dvne,896891,33888,"Dvne is a 5-piece metal band from Edinburgh, UK. Taking influences from a myriad of genres including post metal, doom, and progressive rock. Combining fierce riffs and melodic textures, Dvne travels an epic dark sci-fi universe with hints of psychedelia. Long live the Kwisatz Haderach.  <a href=""https://www.last.fm/music/Dvne"">Read more on Last.fm</a>","Hippotraktor, The Ocean, Psychonaut, Anciients, Julie Christmas"
IOTUNN,339092,16687,"Progressive metal band from Denmark & The Faroe Islands.

Jón Aldará - vocals
Jesper Gräs - guitars
Jens Nicolai Gräs - guitars
Bjørn Wind Andersen - drums
Eskil Rask - bass guitar <a href=""https://www.last.fm/music/Iotunn"">Read more on Last.fm</a>","Anciients, In Vain, Wintersun, Barren Earth, Octoploid"
Tenside,228839,29291,"Tenside is a german school band.

http://www.tenside-music.com
http://www.myspace.com/tensideband <a href=""https://www.last.fm/music/Tenside"">Read more on Last.fm</a>","Any Given Day, Watch Out Stampede!, The Narrator, Rising Insane, Elwood Stray"
200 Stab Wounds,1535779,53498,"200 Stab Wounds is a death metal band from Cleveland, Ohio.  They formed in 2019.  The band consists of Steve Buhl (vocals, guitars), Lance Buckley (guitars), Ezra Cook (bass) and Owen Pooley (drums).  Their lyrical themes include death and decay.  They released their debut EP Piles of Festering Decomposition in 2020.  In 2021, they released their first album named Slave to the Scalpel through Maggot Stomp. They are currently signed to Metal Blade Records. <a href=""https://www.last.fm/music/200+Stab+Wounds"">Read more on Last.fm</a>","Sanguisugabogg, Vomit Forth, Fulci, Gatecreeper, Undeath"
Powerglove,1740784,71762,"Powerglove is an instrumental heavy metal band from Arlington, Massachusetts that performs remixes of video game, cartoon and movie theme music.  They currently have three releases, the EP entitled ""Total Pwnage,"" the full-length ""Metal Kombat for the Mortal Man"" and their latest album Saturday Morning Apocalypse.  Powerglove is predominately influenced by European and Japanese power metal bands, but uses many elements from death metal, black metal and thrash. <a href=""https://www.last.fm/music/Powerglove"">Read more on Last.fm</a>","Daniel Tidwell, Vomitron, GaMetal, FamicomBit, FamilyJules"
