Artista,Reproducciones,Oyentes,Biografía,Artistas_Similares
KESI,2810026,34484,"KESI er en rapper fra Nørrebro i København med rødder i Zanzibar. Kesi startede sin musikalske karriere i 2010, da han som 17-årig lagde sine første sange på videotjenesten YouTube. Her opnåede han sammen med resten af rap-kollektivet B.O.C. på kort tid meget opmærksomhed som reaktion på sange som “Byen Sover” og “Fissehul” (med Gilli). Opmærksomheden betød, at Kesi i 2011 droppede ud af handelsgymnasiet Niels Brock efter at have skrevet kontrakt med pladeselskabet Universal. <a href=""https://www.last.fm/music/Kesi"">Read more on Last.fm</a>",
Reggaeon,10452,1137,"Reggaeon (https://reggaeon.bandcamp.com/) is a Georgian reggae band and is the first and only Reggae group in Caucasus. Founded in 2008 with initiative of vocalist Lasha Nozadze, who was able to unite musicians from different groups. Previously band members had collaborations with different Georgian bands like Alubali and Cece. 

Band members:
Vocals - Lasha Nozadze, Giga Jgarkava
Keyboards - Soso Kapanadze
Bass Guitar - Levan Rusia
Solo Guitar - Mikheil Iashagashvili <a href=""https://www.last.fm/music/reggaeon"">Read more on Last.fm</a>","Erekle Deisadze, ნატო გელაშვილი, Irakli Charkviani, ქართული ხმები, Eko and Vinda Folio"
Sezen Aksu,8310544,196096,"Sezen Aksu (b. 1954) is a pop music singer and songwriter, popular both with a mass audience in Turkey, and with world music fans internationally.

Born Fatma Sezen Yıldırım on the 13 July 1954 in Sarayköy/Denizli, Turkey, she began to study at the local agricultural institute, but gave up her studies to concentrate on music full time. She released her first single, ""Haydi Şansım/Gel Bana"" (Come on My Luck/Come to Me) in 1975. However, she remained undiscovered until her 1976 single ""Olmaz Olsun"" reached number one in the Turkish charts. <a href=""https://www.last.fm/music/Sezen+Aksu"">Read more on Last.fm</a>","Sertab Erener, Ajda Pekkan, Aşkın Nur Yengi, Nilüfer, Göksel"
Ece Mumay,124179,10665," <a href=""https://www.last.fm/music/Ece+Mumay"">Read more on Last.fm</a>","Irmak Arıcı, Hande Ünsal, Bilal Sonses, Emrah Karaduman, İdo Tatlıses"
Bahh Tee,741010,43515," <a href=""https://www.last.fm/music/Bahh+Tee"">Read more on Last.fm</a>","T1ONE, Мичелз, StaFFорд63, Зомб, ST"
Tino Martin,494565,22413," <a href=""https://www.last.fm/music/Tino+Martin"">Read more on Last.fm</a>","wesly bronkhorst, Jeffrey Heesen, Robert van Hemert, Henk Dissel, André Hazes Jr."
Hasibe,62131,5805," <a href=""https://www.last.fm/music/Hasibe"">Read more on Last.fm</a>","Bilal Sonses, Sura İskenderli, Tuğçe Kandemir, Banu Parlak, Ece Mumay"
Tomer Yosef,189723,11296,"Tomer Yosef was born and raised in Kfar Saba, Israel. He began his career as a stand-up comedian in the early nineties, appearing on TV and radio as well as acting in a few Israeli feature films. 

Tomer moved to New York City in 1998 worked with Itamar Ziegler in Zion Train. Two years later, he got together with Tamir Muskat to produce his first album, Say Something. 

He has worked as an electronic artist, and written, composed, and produced with Tamir Muskat. <a href=""https://www.last.fm/music/Tomer+Yosef"">Read more on Last.fm</a>","zikney tzfat, Danny Sanderson, Elai Botner, Alon Eder, Shai Tsabari"
Suspekt,1505928,39823,"There are three artists with this name
1. A danish hip-hop group
2. A Canadian electronic music producer
3. A British hardcore rap crew.

1. SUSPEKT is a danish hip hop / rap group which was made in the 90's. The group originates from the mid 90's, where hip-hop received a great deal of attention in Denmark.
  
At first there were three members: Rune, Andreas and Emil - also known as Rune Rask, Bai-D and Orgi-E, respectively. Over the years the three members were writing a lot of lyrics <a href=""https://www.last.fm/music/Suspekt"">Read more on Last.fm</a>","L.O.C., Gilli, Tobias Rahim, Nik & Jay, The Minds of 99"
Los Secretos,1216013,115523,"Los Secretos is a Spanish group founded in Madrid in the 1980's. Their music was like a breath of fresh air with daily life lyrics. They originally named themselves  ""Tos"", with Urquijos Brothers and Canito. Their breakout album was named like the group, then came ""Todo sigue igual"", ""Algo mas"", etc. The group had a very big handicap with the death of Enrique Urquijo, founder member of the group. Since then Alvaro Urquijo took the responsibility. <a href=""https://www.last.fm/music/Los+Secretos"">Read more on Last.fm</a>","La Guardia, Radio Futura, Nacha Pop, Los Ronaldos, Gabinete Caligari"
The Strokes,359471691,4942918,"The Strokes are an alternative rock band, known for their distinctive sound and cultural impact, particularly in the early 2000s.

Members
Julian Casablancas (vocals), Nick Valensi (guitar), Albert Hammond Jr. (guitar), Nikolai Fraiture (bass), and Fabrizio Moretti (drums)

Formation
The founding process of The Strokes was a serendipitous convergence of childhood connections and a shared musical vision. Julian Casablancas, Fabrizio Moretti, and Nick Valensi, childhood friends with varying musical experiences, came together in the late '90s. <a href=""https://www.last.fm/music/The+Strokes"">Read more on Last.fm</a>","The Voidz, Julian Casablancas, Albert Hammond, Jr., Arctic Monkeys, Alex Turner"
La Oreja de Van Gogh,14924418,546899,"La Oreja de Van Gogh (English: Van Gogh's Ear) is a Spanish band. The name of the band references the Dutch painter Vincent Van Gogh who allegedly cut off his own ear. It was formed in Spain in 1996, when guitarist Pablo Benegas, bassist Álvaro Fuentes, keyboardist Xabi San Martín and drummer Haritz Garde met at university.

San Martin was the vocalist until Amaia Montero joined the band by request from Benegas, just after he met her at a dinner party. <a href=""https://www.last.fm/music/La+Oreja+de+Van+Gogh"">Read more on Last.fm</a>","Amaia Montero, Amaral, La Quinta Estación, Nena Daconte, El Canto del Loco"
Maldita Nerea,1999050,97024,"Maldita Nerea lo forman Jorge Ruiz Flores a la voz y la guitarra, Carlos Molina al bajo, Luis Gomez a la guitarra y Sergio Bernal a la bateria. Con una media de edad de 25 años, este cuarteto de Murcia lleva bastantes años preparandose para el lanzamiento definitivo de su carrera. Todos han pasado por diferentes formaciones y proyectos hasta coincidir en Maldita Nerea. Todo ha sido cuestion de perseverancia, ganas de superarse y fe en sí mismos. <a href=""https://www.last.fm/music/Maldita+Nerea"">Read more on Last.fm</a>","Nil Moliner, El Canto del Loco, Despistaos, Pereza, Melendi"
Sidecars,569045,31397,"Sidecars es un nuevo y joven cuarteto madrileño que aúna la tradición del buen pop-rock en castellano con una admirable habilidad para fabricar melodías de alto valor comercial, sin renunciar a un buen tanto por ciento de honestidad y una pizca de pícara chulería. El grupo está liderado por Juancho -guitarra y voz- y se completa con Manu -guitarra-, Hierbas -bajo- y Ruli -batería-. Sidecars son herederos de la saga que arrancó con Tequila y su genuina fijación “stoniana” <a href=""https://www.last.fm/music/Sidecars"">Read more on Last.fm</a>","Blas Cantó, Leiva, Pereza, El Canto del Loco, Elefantes"
Vetusta Morla,8681850,151901,"Vetusta Morla is a Spanish indie rock band originally from Tres Cantos, Madrid, who sings in Spanish. After nine years of musical journey, in February 2008 they published their first feature, Un día en el mundo. Three years later, in 2011, they published their second album, Maps. On April 8 after several years of touring Spain and other countries, they published their third album,La Deriva. In 2017 they publish their fourth album Mismo Sitio, Distinto Lugar. <a href=""https://www.last.fm/music/Vetusta+Morla"">Read more on Last.fm</a>","Izal, Arde Bogotá, Leiva, Supersubmarina, Viva Suecia"
Bee Gees,53776175,2928188,"The Bee Gees, originally made up of three brothers: Barry Gibb, Robin Gibb (died 2012), and Maurice Gibb (died 2003), have been successful for most of their 40-plus years of recording music. They had two distinct periods of exceptional success: as a pop act in the late 1960s and early 1970s, and as a foremost act of the disco music era in the late 1970s.

The Gibb brothers were born on the Isle of Man, UK to English parents in 1946 (Barry Alan Crompton Gibb <a href=""https://www.last.fm/music/Bee+Gees"">Read more on Last.fm</a>","Robin Gibb, Andy Gibb, Barry Gibb, Captain & Tennille, Leo Sayer"
Suu,141744,10242," <a href=""https://www.last.fm/music/Suu"">Read more on Last.fm</a>","Doctor Prats, Buhos, Ginestà, La Fúmiga, Joan Dausà"
Paula Mattheus,117295,6163," <a href=""https://www.last.fm/music/Paula+Mattheus"">Read more on Last.fm</a>","Mercedes Cañas, Malmö 040, Tres Caladas, Siloé, Alex Wall"
Cesk Freixas,151064,10045,"Cesk Freixas (Francesc Freixas i Morros, Sant Pere de Riudebitlles, 1984) is a young singer-songwriter that, with other artists from the country, returned the singer-songwriter label to the real way, like it used to be long time ago. They are the new generation of catalan singer-songwriter proclaiming injustices with guitars since 2004.


The band is composed by Cesk, composer, vocals and guitar; Victor Nin, electric guitar; Dani Malagarriga, bass; Monty <a href=""https://www.last.fm/music/Cesk+Freixas"">Read more on Last.fm</a>","Feliu Ventura, Els Pets, Lax'n'Busto, Pirat's Sound Sistema, Pau Alabajos"
Valeria Castro,261662,15154," <a href=""https://www.last.fm/music/Valeria+Castro"">Read more on Last.fm</a>","Travis Birds, Xoel López, Mikel Izal, Samuraï, Ginebras"
RAT BOY,4304653,287102,"Jordan Cardy (born 21 February 1996), known by his stage name Rat Boy, is an English musician from Chelmsford, Essex. He studied at Chelmer Valley High School in Chelmsford and went on to study Art at Colchester Institute. Despite being dyslexic, he began writing songs in his spare time, releasing songs on SoundCloud under the name ""Rat Boy"", a name given to him by his school friends who claimed he looked like a rat. After college Cardy was hired and subsequently fired from Wetherspoons <a href=""https://www.last.fm/music/Rat+boy"">Read more on Last.fm</a>",
ZOO,1024971,40466,"There are more than one artist with this name:

1) A rap band formed in 2014 from the city of Gandia in the province of Valencia, Spain. They sing in Valencian and the songs have political lyrics. They are known for incorporating different genres and instruments in the background music. Their music can also be classified under the genres of hip-hop, rock ska and electronics as well as rap. The band was formed by  Panxo (Toni Sánchez), former member of Orxata Sound System and Sophy Zoo. <a href=""https://www.last.fm/music/Zoo"">Read more on Last.fm</a>","Txarango, Oques Grasses, La Raíz, The Tyets, Manel"
Miss Caffeina,1755789,59751,"Miss Caffeina are five guys who are really into making music. Their passion for music has been the motor that has kept  the group running from the moment they formed  to the present day. Together they've recorded 4 EPs and 1 full-length album. The group still finds time to make music even though the members live in different cities around Spain. 

Destrucción Creativa (2007) was their first EP. Recorded in Granada, Spain, with help from Eric from Los Planetas, (who was giving drum lessons in the same studio) amongst others. <a href=""https://www.last.fm/music/Miss+Caffeina"">Read more on Last.fm</a>","Sidonie, Izal, Viva Suecia, Veintiuno, Lori Meyers"
Pau Vallvé,487046,20048," Pau Vallvé (Barcelona 1981) Composer / Producer.

Composer of the soundtrack of ZULO, ""Esto no és un Cuento"" and working within projects such as; ""Por Nosotros"" and ""Suspicious Minds"". Musical producer of '1st Aid Kit', 'Inspira', 'Insomni' besides producing all of his own work. He has created theme music and songs for series and TV shows such as; Porca Miseria (series in TV3), the disc ""SuperXiula"" from Club Super3, for MNAC (National Museum of Art from Catalunya) <a href=""https://www.last.fm/music/+noredirect/Pau+Vallv%C3%A9"">Read more on Last.fm</a>","Maria Jaume, Maria Coma, Mishima, Inspira, Renaldo & Clara"
Chubby Checker,2907770,518551,"Chubby Checker is the stage name of Ernest Evans (born 3 October 1941), an American singer-songwriter best known for popularizing the dance The Twist with his 1960 song ""The Twist"". In September 2008, ""The Twist"" topped Billboard's list of the most popular singles to have appeared in the Hot 100 since its debut in 1958.

He was born in Spring Gulley, SC, USA, and raised in South Philadelphia, Pennsylvania, and attended South Philadelphia High School with Frankie Avalon and Fabian. <a href=""https://www.last.fm/music/Chubby+Checker"">Read more on Last.fm</a>","Bill Haley, Bill Haley & His Comets, Eddie Cochran, Gene Vincent, Carl Perkins"
La Maravillosa Orquesta del Alcohol,1597025,40722,"According to the legend, this peculiar band was created in Grafton Street, one of the main streets in Dublin, where musicians from all over the world meet to make a living by playing alive. Joselito Maravilla (accordion) and Maravilloso David (main vocals, guitar) met over there.

After some months playing on the streets, they decided to come back to Spain and start up a band mixing traditional music (Irish, American and Slavic), rock&roll structures and the most classic blues. <a href=""https://www.last.fm/music/La+Maravillosa+Orquesta+del+Alcohol"">Read more on Last.fm</a>","Xoel López, Guitarricadelafuente, Valeria Castro, Rozalén, Amaia"
Arco,422330,33598,"There are three groups by the name of Arco:

1. Arco are a British band noted for unusually slow, quiet, poetic music: a gig review in national newspaper The Guardian suggested ""an hour in arco's company is the aural equivalent of a day in a flotation tank"". Similarly, a review in Q, a UK monthly music magazine, described first album Coming To Terms as ""the aural equivalent of a human being pausing for thought as the world speeds on around"".

2. Arco (Antonio Arco)  is the former singer from the Spanish band ""El Puchero del Hortelano"". <a href=""https://www.last.fm/music/Arco"">Read more on Last.fm</a>","Codeine, Good Night & Good Morning, The For Carnation, Tram, Low"
Pajaro Sunrise,141518,27657,"Pājaro Sunrise started as a project of Yuri Méndez and Pepe Lopez. Their first and self-titled album, released by Lovemonk Records in November 2006, was recorded, mixed and produced by themselves at their own home. ""Pājaro Sunrise"" was received very well by the music press, it was released in Japan and South-Korea and distributed worldwide. The band got lots of interest from all over the place and toured around Europe, playing in countries like Germany, The Netherlands, Austria, Switzerland, Czech Republic and Belgium. <a href=""https://www.last.fm/music/+noredirect/Pajaro+Sunrise"">Read more on Last.fm</a>",
Miguel Campello,107568,8891," <a href=""https://www.last.fm/music/Miguel+Campello"">Read more on Last.fm</a>","El Canijo de Jerez, elbicho, Antoñito Molina, Juanito Makandé, Nolasco"
AC/DC,189138931,4051287,"AC/DC are an Australian rock band formed in Sydney in 1973 by Scottish-born brothers Malcolm and Angus Young. Their music has been variously described as hard rock, blues rock, and heavy metal, but the band calls it simply ""rock and roll"".

AC/DC underwent several line-up changes before releasing their first album, 1975's High Voltage. Membership subsequently stabilised around the Young brothers, singer Bon Scott, drummer Phil Rudd, and bassist Mark Evans. <a href=""https://www.last.fm/music/AC%2FDC"">Read more on Last.fm</a>","Ozzy Osbourne, Motörhead, Van Halen, Aerosmith, Airbourne"
Triana,742012,39780,"Triana was a Spanish band formed in 1975 in Seville, Andalusia, Spain by Jesús de la Rosa Luque (vocals, keyboards), Eduardo Rodríguez Rodway (vocals, guitar) and Juan José Palacios ""Tele"" (drums, percussion).
They played a fusion of progressive rock and flamenco music, best known as rock andaluz or Andalusian rock.
Their first album, ""El patio"", was released in 1975, followed by ""Hijos del agobio"" in 1977 and ""Sombra y Luz"" in 1979. They released two more albums before Jesús de la Rosa Luque died in a car accident in 1983.
 <a href=""https://www.last.fm/music/Triana"">Read more on Last.fm</a>","Medina Azahara, Derby Motoreta’s Burrito Kachimba, El Último de la Fila, Miguel Ríos, Estopa"
Anıl Emre Daldal,2460143,131689," <a href=""https://www.last.fm/music/An%C4%B1l+Emre+Daldal"">Read more on Last.fm</a>","CanOzan, Dolu Kadehi Ters Tut, Perdenin Ardındakiler, Sena Şener, Simge"
Judit Neddermann,53745,5588," <a href=""https://www.last.fm/music/Judit+Neddermann"">Read more on Last.fm</a>","Clara Peya, Roba Estesa, Pau Vallvé, Doctor Prats, Blaumut"
Fondo Flamenco,591492,51563,"Fonco Flamenco is a group from Sevilla, Spain composed by Astola, Antonio and Rafael. The group started with Astola and Rafael at their early age of 13. Antonio came later on. Astola writes and composes the songs for the group. He is also the one credited for the idea of naming the group Fondo Flamenco. The name came as result of a comment that he made to Rafael while they were taking pictures of themselves in a tipical sevillian courtyard and he told Rafael ""Let's take a picture of us with this flamenco backgroung (fondo flamenco)"". <a href=""https://www.last.fm/music/Fondo+Flamenco"">Read more on Last.fm</a>","Estopa, El Barrio, Andy & Lucas, Melendi, Manuel Carrasco"
Willie Nelson,20867524,1406862,"Willie Hugh Nelson (born April 29, 1933) is an American musician, actor, and activist. The critical success of the album Shotgun Willie (1973), combined with the critical and commercial success of Red Headed Stranger (1975) and Stardust (1978), made Nelson one of the most recognized artists in country music. He was one of the main figures of outlaw country, a subgenre of country music that developed in the late 1960s as a reaction to the conservative restrictions of the Nashville sound. <a href=""https://www.last.fm/music/Willie+Nelson"">Read more on Last.fm</a>","Merle Haggard, Waylon Jennings, Kris Kristofferson, Waylon Jennings & Willie Nelson, George Jones"
Wanda Jackson,3891197,431591,"Wanda Jackson (born Wanda Lavonne Jackson, October 20, 1937 in Maud, Oklahoma) is an American rock and roll singer. Having made her debut recordings at the age of nineteen, she became one of the first popular female rock and roll singers in history and as a result, a pioneering and influential figure in female musicianship. She is known as the ""Queen (or First Lady) of Rockabilly.""

Jackson was still in high school when country singer Hank Thompson heard her sing on an Oklahoma City radio show and asked her to record with his band in 1954. <a href=""https://www.last.fm/music/Wanda+Jackson"">Read more on Last.fm</a>","Gene Vincent, Carl Perkins, Billy Lee Riley, Eddie Cochran, Jerry Lee Lewis"
Gloria Estefan,6120154,682311,"Gloria Estefan (born Gloria María Fajardo, September 1, 1957, in Havana, Cuba) is a seven-time Grammy Award-winning singer-songwriter, actress and social activist. Known as the ""Queen of Latin Pop"", she in the top 100 best-selling music artists with over 100 million albums sold worldwide, 31.5 million of those in the United States. Estefan is the most successful crossover performer in Latin music to date.

Beginning her career in 1975 as lead vocalist for the then exclusively Spanish-language band <a href=""https://www.last.fm/music/Gloria+Estefan"">Read more on Last.fm</a>","Miami Sound Machine, Gloria Estefan and Miami Sound Machine, Jon Secada, Gloria Estefan & Miami Sound Machine, Taylor Dayne"
Yusuf / Cat Stevens,13351334,809460,"Yusuf Islam (born Steven Demetre Georgiou, 21 July 1948),[1] best known by his former stage name Cat Stevens, is a British musician. He is a singer-songwriter, multi-instrumentalist, educator, philanthropist and prominent convert to Islam.

His albums Tea for the Tillerman and Teaser and the Firecat were both certified as Triple Platinum by the RIAA in the United States; his album Catch Bull at Four sold half a million copies in the first two weeks of release alone, and was Billboard's number-one LP for three consecutive weeks. <a href=""https://www.last.fm/music/Yusuf+%2F+Cat+Stevens"">Read more on Last.fm</a>",
Fiona Apple,132083731,2332195,"Fiona Apple McAfee-Maggart is an American singer-songwriter. She released five albums from 1996 to 2020, all of which reached the top 20 on the U.S. Billboard 200 chart. Apple has received numerous awards and nominations, including three Grammy Awards, two MTV Video Music Awards, and a Billboard Music Award.

The youngest daughter of the actor Brandon Maggart, Apple was born in New York City and was raised alternating between her mother's home in New York and her father's in Los Angeles. <a href=""https://www.last.fm/music/Fiona+Apple"">Read more on Last.fm</a>","Björk, Kate Bush, PJ Harvey, Mitski, Mazzy Star"
System Of A Down,374410453,4951227,"System of a Down are an Armenian American metal band, formed in 1994 in Los Angeles, California, USA. All four members are of Armenian descent, and are widely known for their views expressed in many of their songs confronting the Armenian Genocide of 1915 by the Ottoman Empire and the ongoing War on Terror by the US government. The band consists of Serj Tankian (vocals), Daron Malakian (vocals, guitar), Shavo Odadjian (bass, vocals) and John Dolmayan (drums). <a href=""https://www.last.fm/music/System+of+a+Down"">Read more on Last.fm</a>","Daron Malakian and Scars on Broadway, Serj Tankian, Slipknot, Korn, Limp Bizkit"
Shinsei Kamattechan,6300843,294253,"Shinsei Kamattechan (神聖かまってちゃん) is a Japanese alternative rock band from Chiba. Formed in 2007, the band consists of Noko (の子 - lead vocal, guitar, keyboard, razor), mono (bandleader, keyboard, guitar, tambourine), Misako (みさこ - drums, chorus), and Chibagin (ちばぎん - bass, chorus).

The band is well known for broadcasting their activity on live-steaming video sites such as stickam, peercast, and Japanese popular video sharing website Nico Nico Douga. <a href=""https://www.last.fm/music/+noredirect/Shinsei+Kamattechan"">Read more on Last.fm</a>",
BURNOUT SYNDROMES,4068499,209545,"Burnout Syndromes is a three-person rock band that formed in Osaka in 2005. They have released two independent albums to date, Sekaiichi Utsukushii Sekaiichi Utsukushii Sekai and Bungaku Shōjo, as well as the single ""LOSTTIME"" under Tower Records.
In the first 2016 issue of Shueisha's Weekly Shonen Jump magazine was announced that the band Burnout Syndromes would perform a new opening theme song titled ""Fly High!!"" for the Haikyu!! Second Season anime. The new song premiered i <a href=""https://www.last.fm/music/BURNOUT+SYNDROMES"">Read more on Last.fm</a>","SPYAIR, NICO Touches the Walls, KANA-BOON, BLUE ENCOUNT, Flow"
The Killers,295589169,6025554,"There are multiple artists using this name:

1. The Killers are an American  alternative rock band from Las Vegas, Nevada, formed in 2001. 
They got the name from the fictional band The Killers in the video for New Order's song Crystal. 
As of 2021, the band has released six studio albums, which have sold 28 million records worldwide. 

The Early Years
Initially, The Killers played at large clubs in Las Vegas. With the band's line-up stable and their repertoire of songs expanding <a href=""https://www.last.fm/music/The+Killers"">Read more on Last.fm</a>","Brandon Flowers, Kings of Leon, Snow Patrol, Kaiser Chiefs, Franz Ferdinand"
Marcus King,1806224,202578,"Marcus King is an American singer, songwriter, and guitarist. He also fronts The Marcus King Band.  <a href=""https://www.last.fm/music/Marcus+King"">Read more on Last.fm</a>","The Marcus King Band, Tedeschi Trucks Band, Gary Clark Jr., Fantastic Negrito, JJ Grey & Mofro"
Bersuit Vergarabat,4770409,219707,"Bersuit Vergarabat, formed in 1989 in Buenos Aires, Argentina, is one of the most important Argentine rock bands of the 1990s/2000s.

After 2 albums of underground transgressive rock, the band started mixing it with Latin American rhythms such a cumbia, chacarera, candombe and cuartetazo. The lyrics, though, remained acid and critical of political and social problems.

The current line-up is: Gustavo Cordera (voice), Juan Subirá (keyboards and voice) <a href=""https://www.last.fm/music/Bersuit+Vergarabat"">Read more on Last.fm</a>","Patricio Rey y sus Redonditos de Ricota, Los Piojos, Divididos, Viejas Locas, Intoxicados"
Pet Shop Boys,54475393,1930297,"Pet Shop Boys is a British synthpop/dance music duo, consisting of Neil Tennant and Chris Lowe and were formed in London, UK in 1981.

Post-modern ironists cloaked behind a veil of buoyantly melodic and lushly romantic synth pop confections, Pet Shop Boys offer wry yet strangely affecting cultural commentary communicated by the Morse code of synth washes and drum machine rhythms. After first emerging in the mid-'80s with ""West End Girls"" and ""Opportunities (Let's Make Lots of Money) <a href=""https://www.last.fm/music/Pet+Shop+Boys"">Read more on Last.fm</a>","Erasure, Electronic, Orchestral Manoeuvres in the Dark, The Human League, Depeche Mode"
