Artista,Reproducciones,Oyentes,Biografía,Artistas_Similares
Yan Cook,189495,20465,"Yan was born in Kyiv, Ukraine, 1991. At the age of sixteen he was introduced to electronic music, more specifically Techno and his love for it was instantaneous! The rest is history and meanwhile the Ukrainian has performed alongside many of the most respected techno talents from around the globe and collaborated with a number of people in the past, as well as working under different aliases, he is now focusing on his own fully distinguished style which is immediately recognizable from the first seconds of a track. <a href=""https://www.last.fm/music/Yan+Cook"">Read more on Last.fm</a>","Stef Mendesidis, Lewis Fautzi, Rene Wise, Setaoc Mass, Oscar Mulero"
Boye & Sigvardt,150428,35671," <a href=""https://www.last.fm/music/Boye+&+Sigvardt"">Read more on Last.fm</a>","Jeak, XVOTO, April Snow, Tiborg, Paraleven"
Rvdical the Kid,69949,16728," <a href=""https://www.last.fm/music/Rvdical+The+Kid"">Read more on Last.fm</a>","Gafacci, Blaq Jerzee, Smallgod, BwoiiDaas, Moliy"
Recondite,2503771,173856,"Recondite (born Lorenz Brunner in Lower Bavaria) is a German musician, techno producer, label owner and sound artist. Brunner grew up in a rural area which is often named as source of his inspiration. His musical style is attributed as ambient, deep house and techno/acid techno. In fact, Brunner's musical output blurs the boundaries between these categories. The released Albums and EPs include melancholy and gloomy tracks, with a typically low bpm, and also veritable techno tracks created for the dancefloor.  <a href=""https://www.last.fm/music/Recondite"">Read more on Last.fm</a>","Dominik Eulberg, Woo York, Christian Löffler, Efdemin, Mind Against"
Greg Puciato,964888,52252,"Gregory John Puciato (born March 27, 1980) is an American musician best known as the former lead vocalist and lyricist of the metalcore band the Dillinger Escape Plan. He is also the lead singer of the Black Queen and Killer Be Killed, in which he also plays guitar. In 2018, Puciato and visual artist Jesse Draxler co-founded the art collective and record label Federal Prisoner.  <a href=""https://www.last.fm/music/Greg+Puciato"">Read more on Last.fm</a>","The Dillinger Escape Plan, †††, Cave In, Rolo Tomassi, Tomahawk"
Trilo,44230,7721,"Drum & bass producer from Krakow, Poland.

As a child he used to play the guitar and later appeared in several rock and metal bands, but the year 2004 meant a breakthrough for Peter. It was the year when he first got in touch with production from the electronic music scene, namely a CD from Teebee – Through The Eyes Of A Scorpion, which was something like a 180° turnaround.

The first records of his production career date to early 2006, but the year when he became most active was 2008. <a href=""https://www.last.fm/music/Trilo"">Read more on Last.fm</a>","TR Tactics, Symplex, cyntax, AKOV, Mob Tactics"
Nick AM,57081,13753," <a href=""https://www.last.fm/music/Nick+AM"">Read more on Last.fm</a>","LUXAGE, LUCES, Ed.1t, SWAYLÓ, Austin Haga"
Sébastien Tellier,11722119,753357,"Sébastien Tellier is a singer, songwriter and multi-instrumentalist from Paris, France.  He is currently signed to Record Makers.

Tellier's first album, L'incroyable Vérité (The Incredible Truth), was released in 2001. Tellier went on tour with Air in support of the album. The track "" Fantino"" off the album was chosen by Sofia Coppola for the soundtrack to her 2003 film ""Lost in Translation"". Tellier followed L'incroyable Vérité with his second studio album Politics (2005). <a href=""https://www.last.fm/music/+noredirect/S%C3%A9bastien+Tellier"">Read more on Last.fm</a>","Etienne de Crécy, Cassius, Thylacine, Flavien Berger, Yuksek"
DiMO (BG),12103,2145," <a href=""https://www.last.fm/music/Dimo+(BG)"">Read more on Last.fm</a>","Diass, Mascota, Da Le (Havana), DJ Chus, Pavel Petrov"
Arde Bogotá,984980,19072," <a href=""https://www.last.fm/music/Arde+Bogot%C3%A1"">Read more on Last.fm</a>","Viva Suecia, Izal, Vetusta Morla, Lori Meyers, Supersubmarina"
Antonio Orozco,1234466,109289,"Antonio Orozco is a Spanish singer-songwriter from Barcelona, Spain.
He has won several prizes like the Premio Onda and sold lots of records, his first album sold more than 100,000 copies, whereas his second album titled Semilla del Silencio sold over 300,000 copies.
In 2005 he released a self titled album Antonio Orozco, which was a compilation of his best songs (twelve in total) that eventually propelled him into stardom outside Spain, mainly in Latin America and other parts of the world. <a href=""https://www.last.fm/music/Antonio+Orozco"">Read more on Last.fm</a>","Manuel Carrasco, Vanesa Martín, Antonio José, Melendi, Dani Martín"
Ovy On The Drums,1314223,115371," <a href=""https://www.last.fm/music/Ovy+On+The+Drums"">Read more on Last.fm</a>","Sky Rompiendo, Chris Jedi, Myke Towers, Wisin, Ryan Castro"
Jarabe De Palo,7369001,486533,"Jarabe de Palo (literally ""Wooden Stick Syrup"" or, after the Spanish expression ""dar un jarabe de palo"", i.e. a ""hell of a beating""), was a Spanish rock band founded in 1996. The group was led by singer, songwriter, and guitarist Pau Donés, whose death in 2020 caused the band to break up.

Pau Donés, born and raised in Barcelona, worked for various groups before being able to take on his current project, Jarabe de Palo. He began at age 15 with his brother Marc, with whom he formed a group known as J. <a href=""https://www.last.fm/music/Jarabe+de+Palo"">Read more on Last.fm</a>","Los Fabulosos Cadillacs, Fito Y Fitipaldis, Alejandro Sanz, Enanitos Verdes, Enrique Bunbury"
Conan Gray,160162294,1873210,"Conan Gray is an American singer-songwriter and social media personality. He was born on December 5, 1998, in Lemon Grove, California. As an infant, his family moved to Hiroshima, Japan and shortly after returned to California, before settling in Georgetown, Texas.

He started his career on YouTube under his channel 'ConanxCanon' before officially changing to 'Conan Gray'. While on his time on YouTube he released multiple original songs, with the <a href=""https://www.last.fm/music/Conan+Gray"">Read more on Last.fm</a>","Gracie Abrams, Olivia Rodrigo, Maisie Peters, Ricky Montgomery, Lizzy McAlpine"
Glass Animals,103213287,2127389,"Glass Animals are an English electronic/indie rock band formed in Oxford in 2010. The band's line-up consists of Dave Bayley (vocals, guitar, keyboards, drums, songwriting), Drew MacFarlane (guitar, keyboards, backing vocals), Edmund Irwin-Singer (bass, keyboards, backing vocals), and Joe Seaward (drums).

All four members of the band met at St Edward's School in Oxford. Dave Bayley attended St Edward's on a music scholarship and was introduced to Drew MacFarlane <a href=""https://www.last.fm/music/Glass+Animals"">Read more on Last.fm</a>","Sir Sly, Max Frost, half•alive, alt-J, Joywave"
Álvaro De Luna,416501,27732," <a href=""https://www.last.fm/music/%C3%81lvaro+De+Luna"">Read more on Last.fm</a>","Vicco, Lola Indigo, Dvicio, Lérica, Ana Mena"
Nil Moliner,653090,32039,"Nil Moliner es músico y compositor, o como le gusta decir, “escribo
canciones y me río mucho”.
Con su disco debut Bailando en la batalla ha alcanzado el nº2 en la
lista oficial de ventas de álbumes en España. Con su single ""Soldadito
de Hierro (feat. Dani Fernández) ha ganado el certificado de Triple
Disco de Platino en España.
Además, Nil Moliner cuenta ya con varios Disco de Platino por Mi
Religión (x2), ""Bailando, ""Esperando, ""Libertad (x2) y también varios <a href=""https://www.last.fm/music/Nil+Moliner"">Read more on Last.fm</a>","Maldita Nerea, Miki Núñez, Despistaos, Dvicio, Rozalén"
Hotel Ugly,35943101,1417101,"Hotel Ugly’s musical background can be attributed to a number of factors. Influenced at a young age, their music centric backgrounds has given them the legs to stand in their music production. Excelling in different aspects, Mike and Chris both have mastered their craft.

Mike’s skills in music production and audio engineering have been finely combed through the years. Chris’s attention when it comes to songwriting and instrumental is unmatched. <a href=""https://www.last.fm/music/Hotel+Ugly"">Read more on Last.fm</a>","Ralph Castelli, Mind’s Eye, Hector Gachan, crisaunt, Wabie"
El Duende Callejero,35595,3240," <a href=""https://www.last.fm/music/El+Duende+Callejero"">Read more on Last.fm</a>","RaulE, Salistre, Astola, Cosa de Dos Flamenco, Diván du Don"
Luis Cortés,47595,4772," <a href=""https://www.last.fm/music/Luis+Cort%C3%A9s"">Read more on Last.fm</a>","Indara, Antoñito Molina, Daviles de Novelda, RaulE, Lorena Santos"
Dvicio,971876,58692,"Dvicio, known as DVICIO or just DV, is a Spanish pop group. DVICIO signed to Sony Music Spain.

History
During their childhood, the group were close friends who decided to form a group. The beginnings of Dvicio go back to 2009 when the present band members performed under the name Tiempo Límite, encouraged by the success of the popular band El Canto del Loco. As Tiempo Límite, they had minor hits with ""Detrás de mis miedos"" and ""Dueña de mi mente"". <a href=""https://www.last.fm/music/Dvicio"">Read more on Last.fm</a>","Álvaro De Luna, Despistaos, Nil Moliner, Cali & El Dandee, Pablo Alborán"
Diego Torres,2013246,232401,"Diego Antonio Caccia Torres (born March 9, 1971 in Buenos Aires, Argentina) is an Argentine pop singer and composer. He launched his first album, ""Diego Torres"", produced by Cachorro López. This album was rewarded 3 times platinum.

Two years later, and a little distant from TV, he launched his second album called ""Tratar de estar mejor"" which received 5 platinum albums in Argentina and gold and platinum albums in other Latin American countries. This album launched Torres to the international scene. <a href=""https://www.last.fm/music/Diego+Torres"">Read more on Last.fm</a>","Bacilos, Carlos Vives, Franco De Vita, Fonseca, Ricardo Montaner"
DJ Matrix,317858,31703," <a href=""https://www.last.fm/music/DJ+Matrix"">Read more on Last.fm</a>","Gabry Ponte, Max Pezzali, Vasco Rossi, Il Pagante, Ma.Bra."
Ava Max,53013346,1278334,"Amanda Ava Koci (born February 16, 1994), known professionally as Ava Max, is an American singer and songwriter. Ava first got her start in the music industry in 2008 as Amanda Kay, in which she released her first EP titled “Amanda Kay” that year. The EP featured 6 songs that were co-written and produced by Kevin Rudolf. 

Ava would then restart her music career under the name AVA in 2013 and release the single, “Take Away the Pain”.  A year later, she would meet music producer Cirkut and begin recording songs with him. <a href=""https://www.last.fm/music/Ava+Max"">Read more on Last.fm</a>","Bebe Rexha, Kim Petras, Dua Lipa, Mabel, Meghan Trainor"
Edurne,904108,68349,"Edurne García Almagro (Madrid, Spain, born 22 December 1985), known professionally as Edurne, is a Spanish pop singer, actress and TV presenter. She rose to fame in late 2005 when she auditioned for the talent television show Operación Triunfo on Telecinco. She will represent Spain in the Eurovision Song Contest 2015 with the song ""Amanecer"".

Edurne started attending auditions as a child. At 9, she became a member of children's music group Trastos. <a href=""https://www.last.fm/music/Edurne"">Read more on Last.fm</a>","Ruth Lorenzo, Pastora Soler, Ana Guerra, Miriam Rodríguez, Belén Aguilera"
Ana Mena,3272014,102388,"Ana Mena Rojas (born February 25, 1997) is a Spanish singer and actress. She began her career in 2011 in the TV series Marisol, la película (2011). Her musical career began in 2016, when she released her debut single ""No Soy Como Tú Crees"". Mena has collaborated with many well known artists since, including Becky G, CNCO and Lali. In 2018, she released her debut studio album, Index. <a href=""https://www.last.fm/music/Ana+Mena"">Read more on Last.fm</a>","Aitana, Belén Aguilera, Vicco, Lola Indigo, Sofía Martín"
Joel Corry,10363060,729083,"Joel Corry is a British DJ, producer and television personality. He rose to fame in 2019 with the release of his single ""Sorry"", with vocals by Hayley May, which reached number six on the UK Singles Chart. In 2020, Corry released the singles ""Lonely"" and ""Head & Heart."" <a href=""https://www.last.fm/music/Joel+Corry"">Read more on Last.fm</a>","Nathan Dawe, Sigala, Jax Jones, Regard, Meduza"
Lele Pons,1339118,165776,"Eleonora ""Lele"" Pons Maronese (born June 25, 1996) is a venezuelan internet celebrity, YouTuber, actress, singer, dancer, model and former host of La Voz... México.

Pons came to prominence on Vine, before the platform shut down in 2016. She has since branched out, creating comedy sketches for YouTube, where she now has over 14 million subscribers, and 35.3 million followers on Instagram. She has acted in film, television, and in music videos, has released her own music, and co-authored a novel in 2016.  <a href=""https://www.last.fm/music/Lele+Pons"">Read more on Last.fm</a>","Natti Natasha, Becky G, Sofia Reyes, Sofía Reyes, J Balvin"
twocolors,2565858,254628,"twocolors is Pierro and Emil, a German DJ/producer-duo who formed the group in 2015.  Both Pierro and Emil were born and raised in Berlin.  Their major-label debut,""Lovefool"" (a cover/rework of the the song by ""The Cardigans"", surpassed 210 million Spotify streams upon it's release.  They have since released several other tracks which have seen similar success. <a href=""https://www.last.fm/music/twocolors"">Read more on Last.fm</a>","Felix Jaehn, Topic, Fast Boy, Toby Romeo, Glockenbach"
Jerry Di,538566,62684,"Omeba Soto (born November 26, 1992), known professionally as Jerry Di, is one of Venezuela's most important singers and composers.
usic has always been the best therapy for Jerry Di. He claims that life taught him to compose, while music itself taught him to live. He’s mainly influenced by reggaeton, ballads and hip hop in Spanish. <a href=""https://www.last.fm/music/Jerry+Di"">Read more on Last.fm</a>","Beéle, Dalex, Sech, Alex Rose, Justin Quiles"
Danna Paola,7410791,228215,"Danna Paola Rivera Munguía (born June 23, 1995). Beginning at the age of four, Mexico's Danna Paola has lived in the pop-culture spotlight. The winner of many acting and singing awards, Paola began her career as a member of the Mexican television cast of Sesame Street, then at age six won her first leading role in the children's telenovela María Belén and cut her debut album, Mi Globo Azul. The irrepressible youngster with the killer dance moves became a pop sensation at nine with the charting Océano <a href=""https://www.last.fm/music/Danna+Paola"">Read more on Last.fm</a>","Kenia Os, Paty Cantú, Belinda, Tini, HA-ASH"
Internet Money,21655412,911729,"Internet Money is a Los Angeles-based music production collective and label founded by Taz Taylor. Members of the collective have produced for some of rap’s biggest names, including Drake, Juice WRLD, Trippie Redd, Lil Uzi Vert, XXXTENTACION, and many more.

The production members also run a YouTube channel by the same name, Internet Money, where they post beat-making videos, tracks, and general tips.

In October 2019, Internet Money signed a joint venture deal with TenThousand Projects <a href=""https://www.last.fm/music/Internet+Money"">Read more on Last.fm</a>","24kGoldn, Lil Mosey, Bankrol Hayden, Lil Tecca, JACKBOYS"
Ana Bárbara,612248,68279,"Ana Bárbara (born as Altagracia Ugalde Motta January 10, 1971 in Rio Verde, San Luis Potosí), is a Mexican singer. Her maternal grandparents are of Italian origin.

Ana Barbara would become a beauty queen before she reached stardom as a singer: in 1988, she became ""Miss San Luis Potosí"", going on to represent her state in the Miss Universe-sponsored Miss Mexico beauty contest. She lost in her bid to become Miss Mexico, however.

In 1993, Ana Bárbara was proclaimed the ""Ambassador of Ranchera Music"" <a href=""https://www.last.fm/music/+noredirect/Ana+B%C3%A1rbara"">Read more on Last.fm</a>","Grupo Limite, Pilar Montenegro, Alicia Villarreal, Alejandra Guzmán, Yuridia"
Stray Kids,322241367,978436,"Stray Kids (Korean: 스트레이 키즈; RR: Seuteurei Kijeu; often abbreviated as SKZ) are a South Korean boy band formed by JYP Entertainment through the 2017 reality show of the same name. The group is composed of eight members: Bang Chan, Lee Know, Changbin, Hyunjin, Han, Felix, Seungmin, and I.N. Originally a nine-piece group, member Kim Woojin left due to personal circumstances in October 2019.

Stray Kids released their pre-debut extended play Mixtape in January 2018 and officially debuted on March 25 with the EP I am NOT <a href=""https://www.last.fm/music/STRAY+KIDS"">Read more on Last.fm</a>",
Migrantes,469094,38619," <a href=""https://www.last.fm/music/Migrantes"">Read more on Last.fm</a>","Dame 5, EL Villano, Agapornis, Papichamp, Pijama Party"
Jesse & Joy,7284649,341375,"Jesse & Joy are a Latin Grammy award winning Mexican pop duo formed in 2005 by siblings Jesse Huerta (born December 31, 1982) and Joy Huerta (born June 20, 1986).

Jesse & Joy are two young siblings from Mexico City. They began to show a passion for music from a very young age. In 2001 (when they were 18 and 15 years of age), they began writing lyrics and songs with their father. They were later signed under the Warner label on April 18, 2005.

Jesse plays the piano <a href=""https://www.last.fm/music/Jesse+&+Joy"">Read more on Last.fm</a>","Ha*Ash, Reik, Camila, HA-ASH, Paty Cantú"
Adrianne Lenker,59025782,882356,"Adrianne Lenker is a singer/songwriter from Minneapolis, Minnesota and is the lead singer and plays guitar in the critically acclaimed band Big Thief.

Her 2006 debut album ""Stages of the Sun"" consists of all original material that she wrote (some with her father) between the ages of 11 and 14.  Produced by Grammy winner, Steve Hodge. <a href=""https://www.last.fm/music/AdriAnne+Lenker"">Read more on Last.fm</a>",
Jawsh 685,11143031,474801,"Joshua Christian Nanai, better known as Jawsh 685, is a New Zealand music producer. Whilst a student at Manurewa High School, his breakthrough 2020 single ""Savage Love"" with American singer Jason Derulo reached number one in 15 countries, including the United Kingdom, Canada, Australia, and New Zealand.  <a href=""https://www.last.fm/music/Jawsh+685"">Read more on Last.fm</a>","Benny Blanco, BTS, Agust D, j-hope, Jung Kook"
Duke Dumont,12277993,912087,"Before 2012 Duke Dumont was known as a ‘producer’s producer’. He was the name on a 12” record the DJ knew to reach for when he wanted to please the crowd, without them knowing who had constructed the mesmerising sonic confection they were dancing to.

In 2012, two EPs on Tiga’s Turbo Recordings (with whom Duke has had a long standing relationship) changed all that. ‘For Club Play Vol. 1 & 2’ offered up sweet ecstatic deep house & UK bass cuts that have united people across the spectrum of music <a href=""https://www.last.fm/music/Duke+Dumont"">Read more on Last.fm</a>","Gorgon City, Disciples, CamelPhat, Route 94, Sonny Fodera"
Jung Kook,569517397,1051632,"Jeon Jung Kook (Korean/Hangul: 전정국; born September 1, 1997 in Busan, South Korea), known monomously as Jungkook (stylized as Jung Kook) , is a South Korean singer, dancer, composer, and main vocalist of South Korean boy group.

He rose to prominence as a member and vocalist of the South Korean boy band BTS (Hangul: 방탄소년단), under Big Hit Entertainment. 

Debuted with BTS  on June 13, 2013, with the extended play 2 COOL 4 SKOOL and the title track No More Dream <a href=""https://www.last.fm/music/Jung+Kook"">Read more on Last.fm</a>","Jung Kook, Latto, Jung Kook, Jack Harlow, BTS, j-hope, Charlie Puth, Jung Kook, BTS"
Dolly Parton,28593184,1943215,"Dolly Rebecca Parton (born January 19, 1946 in  Sevierville, Tennessee, U.S.) is an American country singer, songwriter, composer, producer, entrepreneur, author and actress.

Parton began performing as a child, singing on local radio and television in East Tennessee. At age 12 she was appearing on Knoxville TV, and at 13, she was recording on a small label and appearing at the Grand Ole Opry in Nashville. When she graduated from high school in 1964 she moved to Nashville <a href=""https://www.last.fm/music/Dolly+Parton"">Read more on Last.fm</a>","Porter Wagoner & Dolly Parton, Loretta Lynn, Reba McEntire, Tammy Wynette, Kenny Rogers & Dolly Parton"
Zoe Wees,2379793,236972,"Zoe Wees is a German singer-songwriter. Born in Hamburg in 2002, Wees wrote music since she was a child and a finalist on “The Voice: Kids”. She released her debut single “Control” in 2019, which reached the Top 40 in France and Germany and the Top 10 in Belgium, while follow-up single “Girls Like Us”reached the Top 10 in Germany, Austria and Switzerland. Wees released her debut EP, Golden Wings, in May 2021. <a href=""https://www.last.fm/music/Zoe+Wees"">Read more on Last.fm</a>","Dean Lewis, Lauren Spencer Smith, Faouzia, Michael Schulte, Mimi Webb"
Justin Bieber,206927670,3844328,"Justin Drew Bieber (born March 1, 1994 in London, Ontario, Canada) is a Grammy Award winning Canadian pop singer, songwriter, and multi-instrumentalist. Bieber was discovered in 2008 by American talent manager Scooter Braun, who came across Bieber's videos on YouTube and later became his manager. Braun arranged for him to meet with entertainer Usher Raymond in Atlanta, Georgia. Bieber was signed to Raymond Braun Media Group (RBMG), and then to an Island Records recording contract offered by record executive L.A. Reid. <a href=""https://www.last.fm/music/Justin+Bieber"">Read more on Last.fm</a>","Poo Bear, Zayn, Shawn Mendes, Chris Brown, One Direction"
Mijares,975533,97741,"Mexican singer Manuel Mijares had his first experience in music while participating in his school chorus at a very young age, making his professional debut in 1981 in a local festival called Valores Juveniles. After living in Japan, singing in a night club, Manuel Mijares joined Latin pop star Emmanuel, starting his solo carer after signing up to EMI, issuing a self-titled album in 1985, climbing charts around Latin America with his first international hit ""No Se Murió El Amor <a href=""https://www.last.fm/music/Mijares"">Read more on Last.fm</a>","Emmanuel, Yahir, Timbiriche, Miguel Bosé, Ricardo Montaner"
Sara Kays,5588703,371020,"Sara Kays (born February 18, 1999) is an American singer and songwriter hailing from Noblesville, Indiana, United States. She discovered her passion for music when she received a guitar from her mother just before turning twelve, leading her to pursue a career in the industry. At the age of thirteen, Kays began performing as a street musician in her hometown, playing cover songs and gradually gaining attention.

After moving to Atlanta for college, Kays continued to develop her skills as a singer, songwriter, and performer. <a href=""https://www.last.fm/music/Sara+Kays"">Read more on Last.fm</a>","Sasha Alex Sloan, Anson Seabra, Lexi Jayde, BLÜ EYES, Avery Lynch"
Jason Derulo,21597929,1412890,"This is an incorrect tag for Jason Derülo. If you have last.fm Autocorrection turned on, your scrobbles will automatically redirect to the correct artist name. Otherwise, please fix your artist ID3 tags. <a href=""https://www.last.fm/music/+noredirect/Jason+Derulo"">Read more on Last.fm</a>",
VOILÀ,4515644,167688," <a href=""https://www.last.fm/music/+noredirect/Voil%C3%A0"">Read more on Last.fm</a>",
La Ross Maria,76575,13537," <a href=""https://www.last.fm/music/La+Ross+Maria"">Read more on Last.fm</a>","Quimico Ultra Mega, La Insuperable, Nino Freestyle, La Perversa, Martin Lora"
blackbear,56753255,1434126,"Matthew Tyler Musto (born November 27, 1990), professionally known as Blackbear (stylized as blackbear), is an American musician, singer, songwriter, and record producer. He has released six studio albums, six EPs, one mixtape and two collaborative albums. Musto is also a member of the alternative hip hop/R&B duo Mansionz with singer-songwriter Mike Posner. <a href=""https://www.last.fm/music/Blackbear"">Read more on Last.fm</a>",
Fujii Kaze,19284101,573655,"Fujii Kaze (藤井風) is a Japanese musician and singer-songwriter under Universal Sigma. Fujii Kaze was born in 1997 in Satosho in Okayama, Japan, and is one of four brothers. As a child, he listened to all kinds of music such as jazz, classical music, pop, and enka. Starting at 12 years old, Kaze uploaded various piano and vocal cover videos on his personal Youtube channel, amassing more than 30 million views.  During his high school years, he suspended uploading to focus on his musical studies; he returned to Youtube after he graduated. <a href=""https://www.last.fm/music/fujii+kaze"">Read more on Last.fm</a>",
Timmy Trumpet,6945177,475057,"Tim Smith (a.k.a. Timmy Trumpet) is a musician, main room house DJ and producer based in Sydney. Smith made his big break in Ibiza; playing live trumpet solos over electronic dance music tracks during DJs shows.

He has supported and played alongside acts like Armin Van Buuren, Carl Cox, Fedde le Grand, Dizzee Rascal, Fatboy Slim and the Stafford Brothers. Timmy is also a regular character on the FOX8 reality TV show The Stafford Brothers.

Timmy <a href=""https://www.last.fm/music/Timmy+Trumpet"">Read more on Last.fm</a>","BlasterJaxx, Dimitri Vegas & Like Mike, Marnik, Mike Candys, Bassjackers"
