Artista,Reproducciones,Oyentes,Biografía,Artistas_Similares
Israel & Rodolffo,6275351,186198,"""Israel & Rodolffo"" é uma dupla sertaneja brasileira formada por Israel Antônio Ribeiro (Goianésia, 23 de dezembro de 1988) e Rodolffo Matthaus da Silva Rios (Uruaçu, 24 de agosto de 1988), na cidade de Jaraguá, em Goiás. A dupla foi formada pelos pais de ambos, Antônio (pai de Israel) e Juarez (pai de Rodolffo), que juntaram os filhos ainda crianças. Em 1999, quando os dois tinham dez anos de idade, gravaram um CD Demo. Daí em diante, não pararam mais de cantar e compor, tendo lançado vários CDs nos anos seguintes. <a href=""https://www.last.fm/music/Israel+&+Rodolffo"">Read more on Last.fm</a>","Hugo & Guilherme, Guilherme & Benuto, Clayton & Romário, Henrique & Juliano, Murilo Huff"
戴羽彤,86617,6721," <a href=""https://www.last.fm/music/%E6%88%B4%E7%BE%BD%E5%BD%A4"">Read more on Last.fm</a>","吕口口, 程響, 小蓝背心, 阿涵, 棉子"
VESNA305,278198,16953," <a href=""https://www.last.fm/music/VESNA305"">Read more on Last.fm</a>","VAVAN, Мохито, Мичелз, Лисицын, 3-ий Январь"
杜宣達,38221,4095," <a href=""https://www.last.fm/music/%E6%9D%9C%E5%AE%A3%E9%81%94"">Read more on Last.fm</a>","1k, 陈村长, 隊長, Firdhaus, 陈子晴"
Daven Wu,44453,4023," <a href=""https://www.last.fm/music/Daven+Wu"">Read more on Last.fm</a>","KeyKey, 隊長, 吴大文, 陈村长, ZQS"
Tiakola,3345741,55398,"William Mundala (born December 4, 1999, in Trizay-lès-Bonneval, France), known professionally as Tiakola, is a French rapper and singer, and a former member of the group 4Keus before his solo career. <a href=""https://www.last.fm/music/Tiakola"">Read more on Last.fm</a>","Gazo, Ninho, Niska, RSKO, Guy2Bezbar"
Emilian,24035,2506," <a href=""https://www.last.fm/music/Emilian"">Read more on Last.fm</a>","Nicole Cherry, Florian Rus, Randi, rares, DoDDy"
Chayce Beckham,715464,69577,"Chayce Beckham is an American singer-songwriter from Apple Valley, California. He was crowned the winner on the 19th season of the reality singing competition show, American Idol. <a href=""https://www.last.fm/music/Chayce+Beckham"">Read more on Last.fm</a>","Bryan Martin, Corey Kent, Warren Zeiders, Kameron Marlowe, Tyler Hubbard"
Cubita,42383,4683," <a href=""https://www.last.fm/music/Cubita"">Read more on Last.fm</a>","Nuno Ribeiro, Rony Fuego, Murta, Nininho, No Maka"
Papaya Dada,31104,2746," <a href=""https://www.last.fm/music/Papaya+Dada"">Read more on Last.fm</a>","Gerardo Morán, Widinson, Guardarraya, Esto es Eso, Cecy Narvaez"
Tananai,2577837,58929,"Tananai, pseudonimo di Alberto Cotta Ramusino, è un cantautore e produttore discografico italiano.
Ha iniziato la carriera musicale nel 2014 con il nome d'arte Not for Us, producendo principalmente musica elettronica, per poi orientarsi verso il genere pop con lo pseudonimo Tananai a partire dal 2018. Raggiunge la notorietà in seguito alla partecipazione al Festival di Sanremo 2022, nel quale il suo brano Sesso occasionale si classifica ultimo, ma riscontra un buon successo radiofonico ed entra nella top 10 FIMI. <a href=""https://www.last.fm/music/Tananai"">Read more on Last.fm</a>","GAZZELLE, Pinguini Tattici Nucleari, Ariette, sangiovanni, Irama"
Maninho,63901,6742,"Maninho nasceu em Porto Alegre, Rio Grande do Sul, no ano de 1979.

Começou cedo na música. Com 8 anos iniciou os estudos de teoria musical, sendo a flauta seu primeiro instrumento.

Logo despertou interesse pelo violão, piano e instrumentos de sopro diversos.

A música católica entrou em sua vida quando, incentivado pelo seu irmão Umberto, que na época já era baterista da Banda Paz e Mel, foi convidado a participar como instrumentista e vocalista nos eventos da Igreja. <a href=""https://www.last.fm/music/Maninho"">Read more on Last.fm</a>","Nuno Ribeiro, Mike11, CAROLINA DE DEUS, No Maka, Ivo Lucas"
温奕心,36261,3802," <a href=""https://www.last.fm/music/%E6%B8%A9%E5%A5%95%E5%BF%83"">Read more on Last.fm</a>","Ycccc, 七叔(叶泽浩), 蒋雪儿 Snow.J, 程響, In-k"
Zehr Vibe,103537,7512," <a href=""https://www.last.fm/music/Zehr+Vibe"">Read more on Last.fm</a>","Jassa Dhillon, Varinder Brar, Jordan Sandhu, The Landers, Nirvair Pannu"
KALUSH,1829822,105158,"KALUSH is a Ukrainian rap group, formed in 2019 and named after Oleh Psyuk's hometown Kalush in Ivano-Frankivsk region, in Western Ukraine. The group consists of founder and rapper Oleh Psiuk, multi-instrumentalist Ihor Didenchuk and dancer Vlad Kurochka.

In 2021, the group launched the side project Kalush Orchestra, with Tymofii Muzychuk, Vitalii Duzhyk, and Dzhonni Dyvnyy as additional members. Unlike the main band, Kalush Orchestra focuses on hip hop with folk motifs and elements from Ukrainian traditional music. <a href=""https://www.last.fm/music/KALUSH"">Read more on Last.fm</a>","Skofka, alyona alyona, YAKTAK, Wellboy, Kalush Orchestra"
Arjan Dhillon,422852,10888," <a href=""https://www.last.fm/music/Arjan+Dhillon"">Read more on Last.fm</a>","Navaan Sandhu, Prem Dhillon, Sidhu Moose Wala, Wazir Patar, HARNOOR"
郑润泽,177403,8155," <a href=""https://www.last.fm/music/%E9%83%91%E6%B6%A6%E6%B3%BD"">Read more on Last.fm</a>","颜人中, 队长, 海洋Bo, 王贰浪, 郭顶"
Amantej Hundal,73438,4478," <a href=""https://www.last.fm/music/Amantej+Hundal"">Read more on Last.fm</a>","Zehr Vibe, Sukha, Deep Jandu, Fateh, Jordan Sandhu"
Italian Somali,30398,2101," <a href=""https://www.last.fm/music/Italian+Somali"">Read more on Last.fm</a>","Yemil, EL CODIGO KIRKAO, Chamaco, Jorkan, [unknown]"
Tony Effe,2360904,53187,"Tony Effe, nome d'arte di Nicolò Rapisarda (Roma, 17 maggio 1991), è un rapper italiano, membro del gruppo trap romano Dark Polo Gang.

Da bambino ha recitato in alcune fiction e film.

Nel giugno del 2021 pubblica il suo primo album Untouchable. <a href=""https://www.last.fm/music/Tony+Effe"">Read more on Last.fm</a>","Capo Plaza, Sfera Ebbasta, Rhove, Geolier, Lazza"
Sasha Chemerov,42927,4065,"View Саша Чемеров <a href=""https://www.last.fm/music/Sasha+Chemerov"">Read more on Last.fm</a>","Antytila, СХОЖА, Artem Pivovarov, BEZ OBMEZHEN, Fiolet"
ycccc,39698,4041," <a href=""https://www.last.fm/music/ycccc"">Read more on Last.fm</a>",
Vicky,120237,18692,"There are at least five artists with this name:

1) Vikram ""Vicky"" Singh is a Punjabi singer associated with the Punjabi Music Industry. He was born in 1993 in Chandigarh, Punjab, India.

2) Vicky is a brazilian singer that made a birthday party and no one friend come. The hit ""Sol e Lua"" is #1 on ANTI LANA DEL RAY Charts.

3) Vicky is an Icelandic rock band. The band unlike most rock bands is lined up with 4 girls and only 1 boy. Vicky has gotten a lot of attention in Iceland and it will be interesting to see what the future brings. <a href=""https://www.last.fm/music/Vicky"">Read more on Last.fm</a>","Tegi Pannu, Jassa Dhillon, Jordan Sandhu, Tyson Sidhu, Amrit Maan"
Tegi Pannu,873921,20294,"Tegbir Singh Pannu known professionally as Tegi Pannu is an Indian-Australian singer, rapper and songwriter who works predominantly in Punjabi music. He became known with his single ""Into You"" with Manni Sandhu. <a href=""https://www.last.fm/music/Tegi+Pannu"">Read more on Last.fm</a>","Jassa Dhillon, Jordan Sandhu, Varinder Brar, Amrit Maan, The Landers"
fromis_9,39728614,424714,"fromis_9 (프로미스나인) is a South Korean girl group formed by CJ E&M through the 2017 reality show Idol School. The lineup currently includes eight members: Lee Saerom, Song Hayoung, Park Jiwon, Roh Jisun, Lee Seoyeon, Lee Chaeyoung, Lee Nagyung, and Baek Jiheon. Initially a nine-member group, Jang Gyuri departed on July 31, 2022. The group's name, fromis_9, blends the words ""promise"" and ""from Idol School,"" symbolizing the members' pledge to become one of the leading girl groups. They were managed by Pledis Entertainment.  <a href=""https://www.last.fm/music/FROMIS_9"">Read more on Last.fm</a>",
小蓝背心,100950,7104," <a href=""https://www.last.fm/music/%E5%B0%8F%E8%93%9D%E8%83%8C%E5%BF%83"">Read more on Last.fm</a>","程響, Joysaaaa, 一口甜, 秦海清, 棉子"
Sylvie Kreusch,594865,43696,"Sylvie Kreusch (Antwerp, 16 May 1991 ) is a Belgian indie pop singer. <a href=""https://www.last.fm/music/Sylvie+Kreusch"">Read more on Last.fm</a>","The Haunted Youth, Eefje de Visser, J. Bernardt, KIDS WITH BUNS, Faces On TV"
MAISONdes,2171523,97277,"MAISONdes is a project based on the concept of being songs of residents in a six-and-a-half tatami apartment somewhere. Each song is its own room, representing the song and stories of its inhabitants. It is meant to bring artists of the same era to move in and collaborate. <a href=""https://www.last.fm/music/MAISONdes"">Read more on Last.fm</a>","Asmi, ZUTOMAYO, ayase, dazbee, Sangatsu no Phantasia"
Kore,609275,34667,"There's two bands called Kore. A Californian Goth band and a French Metal band:

1. From a passionate encounter with Esperanto in 1997, Kris Spitzer, a Frenchman born in the Loire Valley, created Kore (cordially). He spent several years studying and singing the language with an initial group of musicians, which gave birth to a first album, Kia viv’ (what a life) edited by the French production label from Toulouse, Vinilkosmo in 2000. The group played for festivals in Toulouse, Strasbourg, and Angoulême in France. <a href=""https://www.last.fm/music/Kore"">Read more on Last.fm</a>","Khali, Rohff, Prototype, Majestic, Rim'K"
Wellboy,156433,10712,"Anton Oleksandrovych Velboi (Ukrainian: Антон Олександрович Вельбой, IPA: [ɐnˈtɔn olekˈsɑndrowɪtʃ welʲˈbɔj]; born 9 June 2000), professionally known as Wellboy, is a Ukrainian singer and songwriter. He participated in the tenth season of the Ukrainian edition of The X Factor in the team of NK. In 2022, he was announced as one of the finalists of Vidbir 2022, competing with his song ""Nozzy Bossy"" <a href=""https://www.last.fm/music/Wellboy"">Read more on Last.fm</a>","YAKTAK, Kola, Parfeniuk, MamaRika, SHUMEI"
Laylow,12777830,74148,"Laylow is a French rapper originating from Toulouse, of his real name Jeremy Larroux. In 2018, Laylow released the EP's .RAW and RAW-Z. On his first album Trinity that came out on the 28 February 2020, inviting Lomepal, S.Pri Noir, Jok'Air, Wit. and Alpha Wann for collaborations.The album reached number 3 in the French Albums Charts of the week. 

Laylow was born in 1993 in Toulouse a city in the south of France. He lived there until the age of nine <a href=""https://www.last.fm/music/Laylow"">Read more on Last.fm</a>","Josman, Hamza, Alpha Wann, Dinos, Damso"
ANNA,3876406,221824,"There are several artists called Anna: 
1) Anna Santos (Spanish/Japanese) of Latin band BON-BON BLANCO, who solos as ""Anna""
2) German pop band (written ""AnnA"")
3) 90's Rock band from Croydon, England
4) Techno Project (""Schneewittchen EP"")
5) Swiss rap artist (Debut: ""Still Young"", 2006, muve/Musikvertrieb)
6) Ukrainian nu-metal band.
7) Ana Miranda, Lisbon-based brazilian DJ and electronic / ambient music producer (written ""ANNA"")
8) Anna Pepe, Italian rapper from La Spezia <a href=""https://www.last.fm/music/Anna"">Read more on Last.fm</a>","Elodie, Stephan Bodzin, Dusty Kid, Boris Brejcha, Adam Beyer"
Tanishk Bagchi,1220339,68392,"Tanishk Bagchi is an Indian music producer, composer, singer and lyricist in Hindi films. He is known for tracks like ""Bolna"", ""Ve Maahi"", ""Aankh Maarey"", ""Dilbar"" and ""Lut Gaye"". <a href=""https://www.last.fm/music/Tanishk+Bagchi"">Read more on Last.fm</a>","Pritam, Sachin-Jigar, Vishal-Shekhar, Sachet Tandon, Neha Kakkar"
锤娜丽莎,25040,3088,"锤娜丽莎 Haina Lisa, especialista em vídeos curtos, assinou com a gravadora Artisan Entertainment e em 15 de julho de 2020 lançou seu single de debut ""我的世界 (My World)""

Em 2019, conseguiu quase 5 milhões de seguidores em um ano e recebeu 80 milhões de elogios em forma de comentários. Tem uma voz e personalidade únicas, podendo executar uma variedade de conceitos e estilos diferentes de música.

Ainda em 2019, a TV por assinatura Hunan <a href=""https://www.last.fm/music/%E9%94%A4%E5%A8%9C%E4%B8%BD%E8%8E%8E"">Read more on Last.fm</a>","小咪, 赵乃吉, 1k, 戴羽彤, 杨博然"
Garry Sandhu,331382,29121,"At the time Gurmukh is in Class 8th there are 53 students in his class,after there examination the result is as follows Out of 53,One is clear pass,2 are passed with an ER(Essential repeat),rest 50 got failed(including Sadhu)after this Garry quits the studies and fortunately comes in contact with illegal immigrant agent,Garry came to UK at the age of approx 15-17 With the help of some Unworthy Or we can say untrusted Agents,There he started his career <a href=""https://www.last.fm/music/Garry+Sandhu"">Read more on Last.fm</a>","Karan Aujla, Diljit Dosanjh, Sidhu Moose Wala, Amrinder Gill, Ammy Virk"
Brenno & Matheus,296972,60717," <a href=""https://www.last.fm/music/Brenno+&+Matheus"">Read more on Last.fm</a>","Antony & Gabriel, Luan Pereira, Fiduma & Jeca, Bruno & Barretto, Léo Foguete"
Bahaa Sultan,166851,12753,"Please change your tags to Baha'a Sultan. <a href=""https://www.last.fm/music/Bahaa+Sultan"">Read more on Last.fm</a>","Ahmed Saad, Ramy Sabry, Tamer Ashour, Ramy Gamal, Mahmoud El Esseily"
JERRY,275478,19596,"1. Gerard Damien Long, better known as Jerry (formerly Hodgy and Hodgy beats) is an American rapper, producer and one of the founding members of  OFWGKTA (Odd Future Wolf Gang Kill Them All).

2. Jerry is a Punjabi singer, lyricist and composer from Ludhiana. 

3. jerry (also known as prodjerry) is an underground rapper and producer. He often makes music that falls under the hyperpop and digicore subgenres of rap music. <a href=""https://www.last.fm/music/Jerry"">Read more on Last.fm</a>","Tegi Pannu, Hodgy, Matt Champion, Niontay, OFWGKTA"
Muslim - مُسلِم,127782,6427," <a href=""https://www.last.fm/music/Muslim+-+%D9%85%D9%8F%D8%B3%D9%84%D9%90%D9%85"">Read more on Last.fm</a>","Zap Tharwat, Ali Loka, abdulrahman mohammed, Mahmoud El Leithy, Hassan El Shafei"
于冬然,121541,8763," <a href=""https://www.last.fm/music/%E4%BA%8E%E5%86%AC%E7%84%B6"">Read more on Last.fm</a>","En, 承桓, 卢卢快闭嘴, 小阿七, 王靖雯"
Moya Mishel,172197,13532,"Spotify tag for Russian pop group Моя Мишель. <a href=""https://www.last.fm/music/Moya+Mishel"">Read more on Last.fm</a>","MONETOCHKA, Alla Pugacheva, Dima Bilan, Egor Kreed, Мот"
ALEKS ATAMAN,126860,9850," <a href=""https://www.last.fm/music/ALEKS+ATAMAN"">Read more on Last.fm</a>","Тайпан, VAVAN, Agunda, 3-ий Январь, Ислам Итляшев"
Toshi,292802,20069,"1. Brazilian Soul-Hop artist 
2. Toshi is the current lead singer of legendary Japanese rock band X Japan. Не was born in 1965 in Tateyama, Chiba, Japan. Toshi has very beautiful voice that goes over about three octaves. Не started his solo career in 1993 when he was still an active member of X JAPAN before their Last Live. 

In October 22, 2007, there was a reunion announcement of X JAPAN. Toshi joined the group's 3 consecutive shows held in the last days of March, '08 at Tokyo Dome where 150,000 fans gathered from over the world.  <a href=""https://www.last.fm/music/Toshi"">Read more on Last.fm</a>","TOSHI with T-EARTH, Heath, Pata, Violet UK, Ra:IN"
Nicole Cherry,154063,9538,"Nicole Cherry (born Nicoleta Janina Ghinea on 5 December 1998) is a Romanian pop singer of Roma ancestry. Cherry performed in a number of singing and dancing competitions as a child. She gained success in 2013 with her single ""Memories"" which was released at the age of 14. Cherry won the 2014 Zu Music Award for ""Best Breakthrough"" artist. She was chosen to dub the character Sophie in Romanian for Disney movie ""The BFG"" and to sing the main theme from ""Miraculous: Tales of Ladybug & Cat Noir."" <a href=""https://www.last.fm/music/Nicole+Cherry"">Read more on Last.fm</a>","rares, Randi, Vescan, DoDDy, Florian Rus"
Eiby,195043,20646," <a href=""https://www.last.fm/music/eiby"">Read more on Last.fm</a>",
Butrint Imeri,661688,20081," <a href=""https://www.last.fm/music/Butrint+Imeri"">Read more on Last.fm</a>","Dhurata Dora, Elvana Gjata, Yll Limani, Capital T, Mozzik"
SB19,8700175,67520,"SB19 is a five-member Filipino boy band that debuted in 2018 and consists of Josh, Pablo, Stell, Ken, and Justin. They are the first Filipino act trained by ShowBT Philippines. They are also the first Filipino group in Billboard's Next Big Sound chart and the first Southeast Asian act to enter the top 10 of Billboard Social 50 weekly and year-end charts. SB19 promotes its music as part of Pinoy pop, a popular sub-genre of original Filipino music.  SB19 is now a self-managed group under 1Z Entertainment <a href=""https://www.last.fm/music/sb19"">Read more on Last.fm</a>",
BIG Naughty,3272199,131804,"Seo Dong-hyun (서동현; born June 2, 2003) known as BIG Naughty (빅너티) is a South Korean rapper under H1GHR MUSIC. He gained popularity after joining Show Me The Money 8 and was praised for his clever lyrics and ability to hype up a crowd.  <a href=""https://www.last.fm/music/BIG+Naughty"">Read more on Last.fm</a>","ASH ISLAND, BE'O, pH-1, Leellamarz, Coogie"
POLLY,167491,20397,"There is more than one artist with this name:

1) Polly is a French songwriter and singer, known as Daughters of Albion's guitarist and singer. She has released two cover albums.


2)
Karolis - vocals | 
Edit - back vocals | 
Marius - guitar | 
Tomas - bass guitar | 
Justas - drums | 
Rimas - management  | 

3) Polly is also Finnish DJ.

4) Another Polly is the Slovenian hip hop/rap artist, one of the few women in the genre (MySpace).

5) polly (ポーリー) is the name of a Japanese indie-rock band. <a href=""https://www.last.fm/music/Polly"">Read more on Last.fm</a>","君島大空, Haruka Nakamura, school food punishment, Macaroom, [.que]"
Savage,2870019,266133,"There are at least six artists with the name Savage:

1) SAVAGE is an artistic pseudonym of Roberto Zanetti (born in 1956) - the composer, vocalist, producer and also businessman all in one person. His debut on the artistic scene took place in the end of '70s. when he was part of the group called Santarosa (one of the most famous track by this group was ""Souvenir""). From the early '80s he decided to pursue his solo career. His first Italo records were by the group he established called Taxi: ""to Miami"" and ""Kapsi cum"". <a href=""https://www.last.fm/music/Savage"">Read more on Last.fm</a>","Silent Circle, Bad Boys Blue, Fancy, Secret Service, Radiorama"
Mohammad Assaf,163326,18610,"Mohammed Assaf (Arabic:محمد عساف ‎, born in 1 September 1989) is a Palestinian singer well known for being the winner of the second season of Arab Idol, broadcast by the MBC network. He was given the nickname Asaroukh (""The Rocket"") by Lebanese singer and Arab Idol judge  Ragheb Alama. In 2013, Assaf was named a goodwill ambassador for peace by The United Nations Relief and Works Agency for Palestine Refugees (UNRWA). He was also named ambassador <a href=""https://www.last.fm/music/Mohammad+Assaf"">Read more on Last.fm</a>","Toni Qattan, Muhannad Khalaf, محمد عساف, El-Funoun Palestinian Popular Dance Troupe, Shalby Younis"
Sara Carreira,22095,2115,"Sara Carreira, artistic name of Sara Antunes (Dourdan, 21th of October 1999 - Santarém, 5th of December 2020), was a Portuguese singer.

From an early age she was surrounded by the artistic world since she was the daughter of famed Portuguese singer Tony Carreira and his agent Fernanda Antunes, as well as the younger sister of the also popular singers David Carreira and Mickael Carreira.

Following the steps of her family members she launched her own solo career, releasing her first EP, Metade (Half), in November of 2019. <a href=""https://www.last.fm/music/Sara+Carreira"">Read more on Last.fm</a>","Ivo Lucas, Nuno Ribeiro, CAROLINA DE DEUS, D.A.M.A, Rita Rocha"
海来阿木,72103,5823," <a href=""https://www.last.fm/music/%E6%B5%B7%E6%9D%A5%E9%98%BF%E6%9C%A8"">Read more on Last.fm</a>","梦然, 大籽, 赵雷, 花僮, 音阙诗听"
Cristian D,586608,25369," <a href=""https://www.last.fm/music/Cristian+D"">Read more on Last.fm</a>","Yssi SB, Bilal Wahib, Noano, Chivv, Ashafar"
By Индия,374662,21611," <a href=""https://www.last.fm/music/By+%D0%98%D0%BD%D0%B4%D0%B8%D1%8F"">Read more on Last.fm</a>","Kambulat, WHITE GALLOWS, Xcho, A.V.G, Jamik"
Kaśka Sochacka,2073214,38969,"Katarzyna Sochacka (ur. 1990 w Pradłach) – polska wokalistka, autorka tekstów i kompozytorka.

Pochodzi z Pradeł w gminie Kroczyce na terenie Jury Krakowsko-Częstochowskiej. Wychowywała się w muzykalnej rodzinie. Jej ojciec grał na gitarze, a matka Helena była opiekunką Zespołu Pieśni i Tańca „Ziemia Kroczycka”, w którym Katarzyna występowała wraz z rodzeństwem (bracia: Łukasz i Rafał oraz siostra Małgorzata).

Uczęszczała do II Liceum Ogólnokształcącego im. <a href=""https://www.last.fm/music/Ka%C5%9Bka+Sochacka"">Read more on Last.fm</a>","Kortez, Daria Zawiałow, Daria ze Śląska, Sanah, Dawid Podsiadło"
Svyatoslav Vakarchuk,55321,5717,"The front man of Ukraine's most famous and influential rock band, Okean Elzy. <a href=""https://www.last.fm/music/Svyatoslav+Vakarchuk"">Read more on Last.fm</a>","Odyn v kanoe, Arsen Mirzoyan, BEZ OBMEZHEN, Taras Chubay, druha rika"
Mohamed Fouad,184693,24080,"Mohamed Fouad was born on December 20th in Cairo, Egypt

His family was consisting in 3 sisters and 7 brothers. He spend his childhood in Helwan city, then he tend to work in the cinema, he succeed through his albums in the last 10 years. Now Fouad has 3 children Abd El Rahman, Basmala and Alaa.

When Mohamed Fouad came to the light in one of his songs while he was amount a bicycle and playing backgammon and carrying a sheet of paper full of flavor and snatch a loaf of bread .. <a href=""https://www.last.fm/music/Mohamed+Fouad"">Read more on Last.fm</a>","Ehab Tawfik, Hisham Abbas, Mohamed Mounir, Mohamed Hamaki, عمر دياب"
Tsvetelina Yaneva,153962,4402," <a href=""https://www.last.fm/music/+noredirect/Tsvetelina+Yaneva"">Read more on Last.fm</a>",
Lidia,98380,3385,"There are two artists called Lidia. Here's few words about Polish one.

Eglish Version
Lidia won concert TOPTrendy which was in Sopot on July this year. Her solo debut album ""Intuicja"" (""Intuition"") has realed on 27th october. She still sings in German group ""Kind Of Blue"", with who she recorded one album. It was released in the end of 2004. More information and her fan club you can find at www.lidia.art.pl

Polish version: Zwyciężczyni konkursu TOPtrendy 2006 organizowanego przez Telewizję Polsat. <a href=""https://www.last.fm/music/+noredirect/Lidia"">Read more on Last.fm</a>",
Green Apelsin,736206,27644,"Анжела Жиркова (Green Apelsin) — 21-летняя певица, в творчестве которой тесно переплетаются академический вокал и фолк. А в тексты молодой исполнительницы часто обыгрывают сюжеты народных сказок, мифов и легенд. <a href=""https://www.last.fm/music/Green+Apelsin"">Read more on Last.fm</a>","polnalyubvi, Сны Саламандры, алёна швец., Земля Легенд, Дарья Виардо"
Ant Wan,2933071,29717,"Antwan Afram (born 1 January 1998), known professionally as Ant Wan, is a Swedish rapper of Aramean descent from Västerås. He started rapping in Råby and released his first songs in early 2016. His songs gained popularity in late 2016. He made a few songs in 2017 and later in 2018 changed his artist name to Ant Wan. His five-track EP Wow, which included the tracks ""Wow"", ""Kall"", ""Rikare"", ""Fendi"" and ""Boo"", reached the top of the Swedish Albums Chart. <a href=""https://www.last.fm/music/Ant+Wan"">Read more on Last.fm</a>","C.Gambino, Einár, Hov1, Tjuvjakt, Oskar Linnros"
BINI,8238143,85128,"BINI is an eight-member Filipino girl group formed by ABS-CBN Star Hunt Academy, consisting of Aiah, Colet, Maloi, Gwen, Stacey, Mikha, Sheena, and Jhoanna. The group's name was taken from the Filipino word binibini which means ""young lady"", a nod to the group's vision to ""embody the idea of a modern Filipina — sweet, fierce, independent, and informed"". 

On November 20, 2020, they release their pre-debut single ""Da Coconut Nut"".  
On June 4, 2021, the group officially debuted with the single ""Born to Win"".  <a href=""https://www.last.fm/music/Bini"">Read more on Last.fm</a>","ALAMAT, Cup of Joe, Nadine Lustre, Sarah Geronimo, TJ Monterde"
Tuna,904093,17370,"There're several artists named Tuna:

1) Albanian singer
2) Punk Rock band from Brazil 
3) Israeli rapper

1) Altuna Sejdiu was born on 14 July 1985 into an Albanian family in the city of Skopje, then part of the Socialist Republic of Macedonia, present North Macedonia. Her father, Shaban Sejdiu, is a freestyle wrestler and two-time Olympic bronze medal winner.[3][4] Tuna discovered her passion for music at an early age participating in various music festivals. <a href=""https://www.last.fm/music/Tuna"">Read more on Last.fm</a>","Hadag Nahash, Omer Adam, אביתר בנאי, The Idan Raichel Project, Eyal Golan"
Abu,422251,42717,"ABU is a singer/songwriter from Bern, Switzerland.  <a href=""https://www.last.fm/music/ABU"">Read more on Last.fm</a>","Wegz, marwan moussa, Balti, abyusif, Ahmed Saad"
