Artista,Reproducciones,Oyentes,Biografía,Artistas_Similares
Elephant Tree,766694,55083,"Elephant Tree are a new band, just about to start cutting their teeth in the London metal scene. Having moved down and taken in many many gigs and shows the guys have been influenced to start making their own music. Linking up with Pete of Trippy Wicked & the Cosmic Children of the Knight and Stubb in early January and Riley 'Sitar Wizard' MacIntyre soon after, things are snowballing quickly with more songs in the pipelines.  Recording in the summer for their first EP <a href=""https://www.last.fm/music/Elephant+Tree"">Read more on Last.fm</a>","Lowrider, Spaceslug, King Buffalo, Mars Red Sky, 1000mods"
Mother's Cake,651823,51037,"Mother's Cake is an Austrian band playing a mix of funk, hardrock and progressive/psychedelic music. It was formed by Yves Krismer (guitar, vocals), Benedikt Trenkwalder (bass) and Jan Haußels (drums) in 2008. Their distinctive sound is influenced by diverse bands such as The Mars Volta, Porcupine Tree, RHCP and Bootsy Collins among others.

The band came in third place out of roughly 1000 bands at ILA 2010 and won the biggest band contest in Austria - Local Heroes <a href=""https://www.last.fm/music/Mother%27s+Cake"">Read more on Last.fm</a>","Rose Hill Drive, The Intersphere, The Parlor Mob, Black Peaks, Kills Birds"
Bodysnatcher,1435090,69748,"There is more than one artist with this name:

1. Bodysnatcher is a metalcore/deathcore band from Melbourne, Florida currently signed to the MNRK Heavy label. Bodysnatcher consists of: Kyle Medina - vocals, Kyle Carter - guitar, Kyle Shope - bass and Chris Whited - drums

2. Original Dubstep/Electro from UK producers Bodysnatcher. there websites can be found here http://www.myspace.com/bodysnatcherdub http://www.youtube.com/user/Flashjtmusic they have an album called Volume One. <a href=""https://www.last.fm/music/Bodysnatcher"">Read more on Last.fm</a>","Spite, Traitors, Distant, Signs of the Swarm, To the Grave"
The Heavy Eyes,930546,64389,"The Heavy Eyes is psychedelic bluesy rock from the delta that sounds similar to a skeleton driving a speed boat on a flaming Mississippi River headed back to 1969.

Download it this for free at http://theheavyeyesmemphis.bandcamp.com/ <a href=""https://www.last.fm/music/The+Heavy+Eyes"">Read more on Last.fm</a>","Black Rainbows, Killer Boogie, Valley of the Sun, Greenleaf, Dozer"
Reckless Love,2726595,87048,"Reckless Love is a glam metal band from Finland. The band was founded in 2001 and started to gradually gain underground reputation as an energetic live act. Eight years of small scale touring, two line-up changes and four demos later the band finally took it's current form and found it's own recognizable sound. In the spring of 2009 Reckless Love started recording it's debut album and signed a world wide record deal with Universal Music.

After two singles (One More Time <a href=""https://www.last.fm/music/Reckless+Love"">Read more on Last.fm</a>","Wig Wam, Hardcore Superstar, Crazy Lixx, H.E.A.T, Santa Cruz"
ILLUMISHADE,259288,13645,"Illumishade is a Swiss heavy metal band. The band was founded in 2019 by Eluveitie band members Fabienne Erni and Jonas Wolf and makes cinematic and fantasy music, combined with rock and metal. The band is currently signed to Napalm Records. The name is a combination of the English words illumination and shade and refers to the contrast between light and darkness that emerges in the songs, as well as the contrast between quiet and heavy songs.

History <a href=""https://www.last.fm/music/ILLUMISHADE"">Read more on Last.fm</a>","Ad Infinitum, Phantom Elite, Visions of Atlantis, The Dark Side of the Moon, SinHeresY"
Seven Spires,1081922,20830,"Seven Spires was conceived in Boston in 2013 in a bookstore by guitarist Jack Kosto and vocalist Adrienne Cowan. With the additions of old friends Chris Dovas and Peter de Reyna, a complete band was formed. Though young in countenance, the four were armed with highly specialised training from Berklee College of Music, as well as an insatiable drive to earn that which they hungered for.

In their early years, they shared bills with the likes of Arch Enemy <a href=""https://www.last.fm/music/Seven+Spires"">Read more on Last.fm</a>","Unleash the Archers, Helion Prime, Visions of Atlantis, Ad Infinitum, Alterium"
Ignea,837403,41993,"IGNEA was started in Kyiv, Ukraine back in 2011 under name Parallax. Intentionally, it was the first Ukrainian band to play oriental metal. The band, however, didn't limit itself to strict boundaries of oriental metal, and included elements from symphonic, industrial, modern, progressive and other modern subgenres of metal. In 2013, the band entered Morton Studio, well-known rock and metal studio in Ukraine, to record its debut EP, titled Sputnik.  <a href=""https://www.last.fm/music/Ignea"">Read more on Last.fm</a>","Eleine, Ad Infinitum, Blackbriar, Seven Spires, Delain"
Dead by April,20328662,508139,"Dead by April is a modern metal band from Gothenburg, Sweden.

The band released a demo in 2007 and another in 2008, and they both leaked out to several peer-to-peer-sites. During this time they also played in local venues around Gothenburg. The demo also spawned one radio single, Falling Behind. In 2008, the band received two awards, both for Best Newcomer, on “Swedish Pop Awards” and “Bandit Rock Awards”


Their first single “Losing You” was released 6 March, 2009 at their MySpace page. <a href=""https://www.last.fm/music/Dead+by+April"">Read more on Last.fm</a>","Sonic Syndicate, The Unguided, Annisokay, Demotional, My Dear Addiction"
Warbringer,3059797,105540,"There are three artists by this name.

1) Warbringer is an American thrash metal band from Ventura, California formed in 2004. Current members consist of John Kevill as vocals, John Laux and Andrew Bennett on guitar, Andy Laux on bass, and Carlos Cruz behind the drums.  They have released six full length studio albums, the latest being ""Weapons of Tomorrow"" in 2020.  Along with their animated live performances and  lyrics detailing war, violence, and death <a href=""https://www.last.fm/music/Warbringer"">Read more on Last.fm</a>","Havok, Evile, Lich King, Gama Bomb, Death Angel"
Puscifer,21999157,606090,"Puscifer is an American rock group formed in Los Angeles by Maynard James Keenan, known as the lead singer of the bands Tool and A Perfect Circle. Initially, Keenan was the only permanent member, and as such he considered the project to be his ""creative subconscious"". Later, frequent collaborators Mat Mitchell and Carina Round became permanent members.

Puscifer's original name was Umlaut, ""a premiere improvisational hardcore band"". The name ""Puscifer"" was first publicized as a fictional band in the first episode of Mr. <a href=""https://www.last.fm/music/Puscifer"">Read more on Last.fm</a>","A Perfect Circle, Tool, ASHES dIVIDE, How to Destroy Angels, Black Light Burns"
Gojira,66307324,840949,"There are multiple artists called Gojira;

1) Gojira is a metal band from Bayonne, France. Their lyrics focus on life, ecology, and spiritual themes. They were formed in 1996 by brothers Joe Duplantier (vocals and lead guitar) and Mario Duplantier (drums), Christian Andreu (guitar) and Alexandre Cornillon (bass guitar). Cornillon left the band in 2001 and Jean-Michel Labadie became their bass player. Genres that they have been associated with over their career include death metal, progressive metal, thrash metal and groove metal. <a href=""https://www.last.fm/music/Gojira"">Read more on Last.fm</a>","Mastodon, Meshuggah, Opeth, Lamb of God, Death"
Ocean Grove,2724034,94105,"[1] Ocean Grove is an Australian nu metal band formed in 2010. The band consists of vocalist Dale Tanner, drummer/producer Sam Bassal and bassist/vocalist Twiggy Hunter. Studio-only member Running Touch (real name Matthew Victor Kopp)  also provides synthesizers and additional production.

As of 2022, the band has released four studio albums; The Rhapsody Tapes (2017), Flip Phone Fantasy (2020), Up In The Air Forever (2022), and Oddworld (2024); along with two EP's; Outsider (2013) and Black Label (2015) <a href=""https://www.last.fm/music/Ocean+Grove"">Read more on Last.fm</a>","Darke Complex, Cane Hill, Void of Vision, Northlane, Diamond Construct"
LOVEBITES,1045667,24451,"LOVEBITES is a young Japanese heavy metal / power metal all female band from Tokyo. The initial line up consists of: Asami (vocals), Midori (guitar), Miho (bass), Haruna (drums) and   Miyako (guitar/keyboard). Their first live performance took place in November 18, 2016 at Shibuya. Soon after on 24 May, 2017 the band has released 4-track minialbum ""THE LOVEBITES EP"" promoted by a MV ""Don't Bite The Dust"".

On summer 2017, the band has announced an upcoming full-lenght album ""AWAKENING FROM THE ABYSS"" to be released on 25/10 this year. <a href=""https://www.last.fm/music/Lovebites"">Read more on Last.fm</a>","Aldious, Mary's Blood, Hagane, NEMOPHILA, Bridear"
Kadavar,3129769,138321,"There are multiple artists with this name:

1) Kadavar is a progressive / hard / psychedelic rock band from Berlin, Germany. The play a sort of retro rock / proto-metal with occult themes.

Current line-up:	
Christoph ""Wolf"" Lindemann - vocals, guitar
Christoph ""Tiger"" Bartelt - drums
Simon ""Dragon"" Bouteloup - bass

Former members:
Philipp ""Mammut"" Lippitz - bass

2) Kadavar was an old school death metal band formed in 2007 from Milan, Italy. The band managed to release a demo, EP, and a full length before disbanding in 2009. <a href=""https://www.last.fm/music/Kadavar"">Read more on Last.fm</a>","Graveyard, Greenleaf, Witchcraft, 1000mods, Horisont"
Marko Hietala,352876,25500,"Famous bass player and singer of the Finnish metal acts Nightwish and Tarot. Sang two 'metallized' versions of traditional Christmas songs for the compilation Raskasta Joulua and two more for compilation Raskaampaa Joulua.

From Wikipedia, the free encyclopedia:
Marco Hietala (born January 14, 1966 in Finland) is the bassist and second vocalist of the Finnish symphonic metal band Nightwish. He joined the band for their 2002 album Century Child, following the departure of previous bassist Sami Vänskä. <a href=""https://www.last.fm/music/Marko+Hietala"">Read more on Last.fm</a>","Leverage, Tarot, Tuomas Holopainen, Dynazty, Northern Kings"
Theory of a Deadman,24280734,1197937,"Theory of a Deadman (or Theory for short) is a rock band from North Delta, British Columbia, Canada, formed in 2001, signed by Nickelback vocalist Chad Kroeger to 604 Records, after lead singer Tyler Connolly gave Kroeger a demo tape. The band also includes traits of other music styles, such as country, metal and more acoustic elements. Theory has released eight studio albums and three #1 hits on the Mainstream Rock Chart. The band scored the entire soundtrack for the video game, ""Indigo Prophecy"" / ""Fahrenheit"". <a href=""https://www.last.fm/music/Theory+of+a+Deadman"">Read more on Last.fm</a>","Hinder, Shinedown, Saving Abel, Pop Evil, My Darkest Days"
Ninkharsag,408510,27234,"Inspired by black magick, dark history, nature and warfare, Ninkharsag delve deep into forgotten lore to imbue a feeling of ancient archaism to their compositions. 

Musically, they have been compared to paragons of the genre such as Emperor, Mayhem, and Dissection; but Ninkharsag has their own unmistakable style which sets them apart from other contemporary bands and drags the classic 90’s black metal sound into the 21st century. <a href=""https://www.last.fm/music/Ninkharsag"">Read more on Last.fm</a>","Warmoon Lord, Nordjevel, Sarastus, Doedsvangr, White Rune"
The Wise Man's Fear,974239,45449,"The Wise Man's Fear is an American Metalcore band from Central Indiana consisting of: Tyler Eads (clean vocals), Joseph Sammuel (harsh vocals), Codi Chambers (lead guitar), Nathan Kane (rhythm guitar/vocals), Thomas Barham (bass), and Paul Lierman (drums and lyrics).

The group debuted its first full-length record, ""Castle in the Clouds"", in the summer of 2015. The album chronicles the adventures of a young knight (representative of mankind) on his quest to find a legendary Castle and allegorically, the meaning of life. <a href=""https://www.last.fm/music/The+Wise+Man%27s+Fear"">Read more on Last.fm</a>","If I Were You, Hollow Front, City State, Kingdom of Giants, Like Moths to Flames"
Falconshield,610558,34636,"   My name is Josef Falkensköld, and I employ myself as a composer and sound designer for various media, mainly Games and Television.
   I live just outside the city of Umeå, a town located in northern sweden. <a href=""https://www.last.fm/music/Falconshield"">Read more on Last.fm</a>","The Chalkeaters, Pentakill, FamilyJules, Jonathan Young, boi what"
The Pineapple Thief,8483482,208513,"In April 2008 The Pineapple Thief launched the Kscope label with the critically acclaimed album, Tightly Unwound.

Initially a solo outlet for Bruce’s music the first album, Abducting the Unicorn, was released on Cyclops Records in May 1999. The critical plaudits and small but fanatical fan base that grew around the release was enough to convince Bruce that perhaps TPT was here to stay and he returned to the Dining Room studios to work on the second TPT album, 137. <a href=""https://www.last.fm/music/The+Pineapple+Thief"">Read more on Last.fm</a>","Bruce Soord, Steven Wilson, Riverside, Blackfield, Gazpacho"
Butcher Babies,1948732,82907,"Butcher Babies is an American heavy metal band from Los Angeles, California. Consisting of frontwomen Heidi Shepherd and Carla Harvey, guitarist Henry Flury (Amen), and drummer Chase Brickenden, the band signed a worldwide deal with Century Media Records in 2012, and later embarked on a North American tour with Marilyn Manson. Their debut album, Goliath, was released in 2013 via Century Media Records. It sold 3,300 copies in the US during its first week of release and charted at No. <a href=""https://www.last.fm/music/Butcher+Babies"">Read more on Last.fm</a>","Infected Rain, In This Moment, September Mourning, Fate DeStroyed, The Agonist"
Anvil,2440243,159820,"There is more than one artist using the name Anvil:

1)  Anvil is a Canadian heavy metal band who has influenced many musical groups including Slayer and Metallica. The band's history is chronicled in the 2009 documentary Anvil! The Story of Anvil.

2) Anvil is a1970s German heavy prog psych band.

--==--

1) - The roots of Anvil began in April 1973 in Toronto, when high school friends Steve ""Lips"" Kudlow and Robb Reiner began playing music together. <a href=""https://www.last.fm/music/Anvil"">Read more on Last.fm</a>","Metal Church, Tokyo Blade, Armored Saint, Exciter, Accept"
Iron Savior,3610368,142629,"Iron Savior is a German power metal band that was formed in Hamburg in 1996. Following a period of several years working behind the scenes in music production, multi-instrumentalist and producer/engineer Piet Sielck joined with former Helloween bandmate Kai Hansen and then-drummer for Blind Guardian, Thomen Stauch in a new project that would blend power metal with a high-concept science fiction story. The band's debut album Iron Savior introduced the story that would be told over the course of multiple albums <a href=""https://www.last.fm/music/Iron+Savior"">Read more on Last.fm</a>","Primal Fear, Gamma Ray, Grave Digger, Bloodbound, Firewind"
Psychonaut 4,3902311,84193,"Psychonaut 4 is a Georgian black metal band from Tbilisi, Georgia, formed in July 2010 by GRAF (vocals) and André (bass). The lyrics are written by GRAF and are about drugs, sex, drinking, depression, lies and suicide.
Psychonaut 4 started with a demo tape titled ""40%"", released by Depressive Illusions Records in 2011. In June 2012 the band released ""Tired, Numb, Still Alive"", a 3-way split album with Unjoy and Eurythmie, released by Der Neue Weg Productions. <a href=""https://www.last.fm/music/Psychonaut+4"">Read more on Last.fm</a>","Nocturnal Depression, Lifelover, Apati, Happy Days, My Useless Life"
Svartkonst,154165,16145,"Chainsaw Blackened Death Metal one-man band from Härnösand, Sweden, founded in 2012. <a href=""https://www.last.fm/music/Svartkonst"">Read more on Last.fm</a>","Sodomisery, Thron, Doedsvangr, Hovmod, Mephorash"
Murderdolls,7934758,336438,"Murderdolls were an American horror punk supergroup, founded during 2002 in Hollywood, California. The band line-up consists of core members Wednesday 13 and Joey Jordison of Slipknot. Former members include Ben Graves, Acey Slade, Eric Griffin and Tripp Eisen.

The band has released two albums, the first in the form of Beyond the Valley of the Murderdolls which was released in 2002. The band had limited initial success in the United States, though <a href=""https://www.last.fm/music/Murderdolls"">Read more on Last.fm</a>","Wednesday 13, Frankenstein Drag Queens from Planet 13, Blitzkid, Calabrese, Doyle"
Sarah and the Safe Word,1055856,51568,"Sarah and the Safe Word are a Rock Cabaret band from Atlanta, Georgia. <a href=""https://www.last.fm/music/Sarah+and+the+Safe+Word"">Read more on Last.fm</a>","Will Wood and the Tapeworms, Dirt Poor Robins, Kabaret Sybarit, Will Wood, A Verbal Equinox"
1000mods,1859380,87063,"1000mods is a psychedelic/stoner rock band from Chiliomodi, Greece. They were formed in the summer of 2006 and since then, they have played hundreds of live shows, including openings for Brant Bjork, Colour Haze, Karma to Burn, My Sleeping Karma, Radio Moscow and many others. Their commitment to vintage equipment, thick and heavy analog sound and their remarkably passionate on stage performance is what sets them apart.

In the beginning of 2007 they released their first (self-financed) EP “Blank Reality” on CD <a href=""https://www.last.fm/music/1000mods"">Read more on Last.fm</a>","Truckfighters, Greenleaf, Stoned Jesus, The Devil And The Almighty Blues, Dozer"
Breakdown of Sanity,6480439,98954,"Breakdown of Sanity was a melodic metalcore/deathcore band formed in Spring 2007 in Bern, Switzerland.

The band's name is intended to reflect the aggression of the music and the gloomy zeitgeist of today's society. Breakdown of Sanity is one of the DIY movement in the typical hardcore punk bands of the early years was. Breakdown of Sanity is a registered member of SUISA .
Breakdown of Sanity played their last concert in 2017 in their hometown Bern. <a href=""https://www.last.fm/music/Breakdown+of+Sanity"">Read more on Last.fm</a>","Feed Her to the Sharks, Buried in Verona, Miss May I, Caliban, August Burns Red"
Æther Realm,1914741,56182,"Melodic death metal with folk and viking themes from North Carolina.

Vincent Jones - Bass/Vocals
Tyler Gresh - Drums
Donny Burbage - Guitar
Heinrich Arnold - Guitar

Bandcamp, support the band! <a href=""https://www.last.fm/music/+noredirect/%C3%86ther+Realm"">Read more on Last.fm</a>","Nekrogoblikon, Wizardthrone, Whispered, Imperial Circus Dead Decadence, Wilderun"
Drakum,183957,18903,"Drakum is a folk metal band from Barcelona, Spain. The band started in December 2009, after a year looking for the right members.  In 2010 they were immersed in the songwriting and recording their first demo ""Around The Oak"". In 2011 they were promoting 'Around The Oak ""receiving rave reviews, and started the live activity, which has led them to cross their borders, playing festivals in various countries such as Slovenia, Croatia and Ukraine. In 2014 they released their first LP ""Torches Will Rise Again"". <a href=""https://www.last.fm/music/Drakum"">Read more on Last.fm</a>","Northland, Wolfchant, Vanir, Grimner, Heathen Foray"
Boundaries,3247079,55963,"There are several artists named Boundaries:

1) Boundaries is a five-piece metalcore band from Hartford, Connecticut, comprising of frontman Matt McDougal, drummer Tim Sullivan, bassist Nathan Calcagno and Cody DelVecchio and Cory Emond both on guitars. They released their first full-length album Your Receding Warmth in 2020, and their second full-length offering, Burying Brightness in 2022. The band is currently signed to 3DOT Recordings.

2) Boundaries is a shoegaze/post-punk band from Denmark. <a href=""https://www.last.fm/music/Boundaries"">Read more on Last.fm</a>","Foreign Hands, Boundaries, Matt Honeycutt, Dying Wish, Counterparts, Knocked Loose"
Joel Lindfors,117014,16407," <a href=""https://www.last.fm/music/Joel+Lindfors"">Read more on Last.fm</a>","Jake Howsam Lowe, Stephen Taranto, Interiors, Poh Hock, Connor Kaminski"
Svrm,323548,20599,"Atmospheric black metal from Kharkiv, Ukraine.
See Bandcamp for releases. <a href=""https://www.last.fm/music/svrm"">Read more on Last.fm</a>","Windswept, Drudkh, Khors, They Came From Visions, Ellende"
Lords of Black,326005,18808,"Lords of Black is a Spanish power metal band formed in Madrid in 2014 by guitarist Tony Hernando and singer Ronnie Romero.

Founding, early career
Tony Hernando founded, Lords Of Black with Ronnie Romero. They were joined in the project by drummer Andy Cobos who was previously in Saratoga with Hernando and they begin writing and recording their debut album with Tony Hernando and Roland Grapow acting as producers. Their debut, self-titled album, Lords of Black, was released in May 2014. <a href=""https://www.last.fm/music/Lords+of+Black"">Read more on Last.fm</a>","The Ferrymen, Manimal, Nils Patrik Johansson, Allen-Lande, Firewind"
Nachtblut,1115476,33211,"There are at least three bands called Nachtblut:

(1) Melodic Dark / Black Metal from Osnabrück, a small city near the economical and cultural metropolis Mettingen, in Germany.. Formed in 2005 by the singer and songwriter Askeroth. Released their first album ""Das erste Abendmahl"" in 2007. In the year 2009 they released their second album, titeld ""Antik"". http://www.nachtblut.com They have played several concerts in Mettingen, Wersen, Lotte and Ibbenbüren.  <a href=""https://www.last.fm/music/Nachtblut"">Read more on Last.fm</a>","Schwarzer Engel, Dorn, Eisregen, Dark the Suns, Cryptic Wintermoon"
Helleruin,191578,14280,"Helleruin is a Dutch black metal project from Groningen, founded in 2015. All studio instruments and vocals by Carchost. <a href=""https://www.last.fm/music/Helleruin"">Read more on Last.fm</a>","Warmoon Lord, Sarastus, Ninkharsag, Primordial Serpent, Doedsvangr"
Words Of Farewell,713279,27544,"Words of Farewell is a progressive/melodic death metal band from Münster/Ruhr, Germany formed in early 2007.

After four months of rehearsing, the 7 track EP 'Ashes of the Coming Dawn ' was recorded at Boombox Studios in Lünen and published in a quantity of 500 units.

In autumn 2008 the band recorded the 4 track CD 'From Now On...' for promotional purposes at Total Recall Studios in Herten. It was pressed in limited numbers to be sent out to record labels and venues, distributed at live concerts and additionally offered as free download. <a href=""https://www.last.fm/music/Words+of+Farewell"">Read more on Last.fm</a>","Fractal Gates, Horizon Ignited, Eye of the Enemy, Countless Skies, Lahmia"
Caligula's Horse,4878744,87723,"Taking their name from the mad Roman emperor and his beloved steed Incitatus, Caligula's Horse is an Australian progressive rock/metal band intent on bridging the gap between dynamic, meaningful songwriting and instrumental prowess.

The brainchild of guitarist, songwriter and producer Sam Vallen, Caligula's Horse - initially composed of just Vallen and vocalist Jim Grey - released its digital debut “Moments From Ephemeral City” in April 2011 <a href=""https://www.last.fm/music/Caligula%27s+Horse"">Read more on Last.fm</a>","Haken, Leprous, VOLA, Earthside, TesseracT"
Yoth Iria,242446,16347,"After years of inner peace, the chants of the unholy can now be heard again. A grand blend of heavy/doom and epic black metal that will travel the underground into dark realms and silent hills....
A sinister offspring of Jim Mutilator and The Magus.

A massive comeback from the duet, which developed and pioneered the underground scene back in the day. Jim Mutilator was the first bassist and a founding member of the Greek black metal band Rotting Christ. <a href=""https://www.last.fm/music/Yoth+Iria"">Read more on Last.fm</a>","Rotting Christ, In Aphelion, Winterfylleth, Sakis Tolis, Seth"
Code Orange,6220547,199019,"Code Orange (formerly Code Orange Kids) is an American metalcore band that formed in Pittsburgh, Pennsylvania, United States in 2008. The band consists of guitarist, keyboardist and backing vocalist Eric ""Shade"" Balderose, guitarist and vocalist Reba Meyers, vocalist and drummer Jami Morgan, bassist Joe Goldman, guitarist Dominic Landolina and session drummer Ethan Young.

The band signed to Deathwish Inc. for their first two studio albums: Love Is Love/Return to Dust released in 2012 and I Am King in 2014. <a href=""https://www.last.fm/music/Code+Orange"">Read more on Last.fm</a>","Code Orange Kids, Jesus Piece, Harm's Way, End, Vein.fm"
The Red Jumpsuit Apparatus,28200235,1396168,"The Red Jumpsuit Apparatus is an alternative rock/post-hardcore band that was originally formed in 2003 in Middleburg, Florida, about 30 miles south west of Jacksonville. The current members of the band are Ronnie Winter, the lead vocalist, Joey Westwood, bassist, Josh Burke, guitarist,  & Jon Wilkes, drummer, all of whom do back-up vocals. 

Art often thrives in the aftermath of adversity, and since we last heard from Red Jumpsuit Apparatus, there have been plenty of variables that the five-piece alternative rock act had to endure. <a href=""https://www.last.fm/music/The+Red+Jumpsuit+Apparatus"">Read more on Last.fm</a>","Mayday Parade, We the Kings, Secondhand Serenade, Yellowcard, Story of the Year"
