Artista,Reproducciones,Oyentes,Biografía,Artistas_Similares
Sachin-Jigar,2300329,89200,"Sachin–Jigar is a music composer duo from Mumbai, India, consisting of Sachin Sanghvi and Jigar Saraiya. They compose for Bollywood and Gujarati movies. They have scored a number of successful soundtracks. Before working independently as music director duo, they were assisting Pritam in set up musical arrangements.

Sachin–Jigar has created music at various platforms from theatre to television soaps to jingles. They must have done not less the 500 plays and not less than 5000 television episodes for various genres and channels. <a href=""https://www.last.fm/music/Sachin-Jigar"">Read more on Last.fm</a>","Pritam, Vishal-Shekhar, Tanishk Bagchi, Vishal Mishra, Sachet Tandon"
Klara Hammarström,496224,22270,"Klara Lovisa Hammarström (born 20 April 2000 in Stockholm) is a Swedish singer and television personality.

She appeared along with her family in the TV show Familjen Hammarström on SVT and has participated three times in Melodifestivalen: in 2020 with the song ""Nobody"" failing to qualify from the semi-finals, in 2021 with the song ""Beat of Broken Hearts"" placing 6th in the final and in 2022 with the song ""Run to the Hills"" placing again 6th in the final of the event. <a href=""https://www.last.fm/music/Klara+Hammarstr%C3%B6m"">Read more on Last.fm</a>","Dotter, Wiktoria, Tone Sekelius, Mariette, Lisa Ajax"
Jay Melody,15400,1370,"Born Sharif Said Juma on June 12, 1997 in Dar es Salaam. <a href=""https://www.last.fm/music/Jay+Melody"">Read more on Last.fm</a>","Billnass, Phina, Mbosso, Kusah, Ibraah"
YAKTAK,116756,7586," <a href=""https://www.last.fm/music/YAKTAK"">Read more on Last.fm</a>","Wellboy, Kola, SHUMEI, 100лиця, DOROFEEVA"
Monika LIU,740619,42780,"Monika Liubinaitė, known professionally as Monika Liu, is a Lithuanian singer. She started her musical career in Klaipėda (Lithuania) at the age of five, when she started to study violin. She discovered singing only ten years later and immediately triumphed in the ""Song of Songs"" competition. After graduating from school, Monika chose jazz music and vocal studies at the Faculty of Music of Klaipeda University. She has released 3 albums lunatik  (2019) <a href=""https://www.last.fm/music/Monika+Liu"">Read more on Last.fm</a>","Systur, Blanca Paloma, Mimicat, THE ROOP, La Zarra"
Tom Grennan,5314805,337632,"
Tom Grennan (born in Bedford) is a British singer-songwriter currently based in London.

Grennan was born in Bedford. His father is a builder, and his mother was a teacher. He is of Irish/English origin and a big fan of football and particularly Manchester United. He played football at a young age for the Bedford Park Tigers. He attended St Thomas More Catholic School. His younger brother is an aspiring boxer.

At 18, he was mugged by a group of <a href=""https://www.last.fm/music/Tom+Grennan"">Read more on Last.fm</a>","Tom Walker, Freya Ridings, Ella Henderson, BANNERS, Scouting for Girls"
1K,114392,8958," <a href=""https://www.last.fm/music/1k"">Read more on Last.fm</a>","陈村长, 隊長, 小咪, Firdhaus, 周星星"
Gulab Sidhu,52642,3739," <a href=""https://www.last.fm/music/Gulab+Sidhu"">Read more on Last.fm</a>","Saabi Bhinder, Jordan Sandhu, Nirvair Pannu, Khan Bhaini, Pavitar Lassoi"
Ana Moura,1366316,81964,"Portuguese vocalist Ana Moura, whose soulful and riveting interpretation of her land's captivating fado style has made her a star in Europe.

Ana Moura has become a leading exponent of this poetic, deeply expressive idiom which personifies the Portuguese psyche as it explores such universal themes as lost love, separation, and longing.

As Ana explains, ""It's very special because it's all about emotions and feelings. It needs no translation.""

Ana was born in 1980 <a href=""https://www.last.fm/music/Ana+Moura"">Read more on Last.fm</a>","Mariza, Carminho, The Gift, António Zambujo, Amália Rodrigues"
星野,94784,7856," <a href=""https://www.last.fm/music/%E6%98%9F%E9%87%8E"">Read more on Last.fm</a>","陈村长, 隊長, KeyKey, Daven Wu, Space X"
Vitor e Luan,545714,53749," <a href=""https://www.last.fm/music/Vitor+e+Luan"">Read more on Last.fm</a>","Luiz Henrique e Leo, Bruno & Denner, Max e Luan, João Gustavo e Murilo, Murilo Huff"
Nikita Kering',47570,6275,"Nikita Chepchumba Kering', popularly known as Nikita Kering', is a Kenyan musician, actress and media personality. She was born in February 2002 and has been releasing music since 2018. <a href=""https://www.last.fm/music/Nikita+Kering%27"">Read more on Last.fm</a>","Nviiri The Storyteller, Chris Kaiga, Njerae, Mutoriah, Brandy Maina"
Mert Demir,839742,30532," <a href=""https://www.last.fm/music/Mert+Demir"">Read more on Last.fm</a>","Melike Şahin, Mabel Matiz, Gökhan Türkmen, Zeynep Bastık, Sezen Aksu"
Assala Nasri,334154,14983,"Assala was born in Damascus, Syria[1] to a middle class couple. Mostafa Nasri, Assala's father, was a revered composer and singer. Assala began her musical career by performing patriotic, religious, and children's songs when she was four years old. She sang the theme song ""Qessas Al Sho'oub"" (Arabic: قصص الشعوب), of the cartoon show, Hekayat Alamiyah (Arabic: حكايات عالمية). In 1986, Mostafa Nasri died after suffering from internal bleeding caused by a car accident. <a href=""https://www.last.fm/music/Assala+Nasri"">Read more on Last.fm</a>","Angham, Elissa, عمر دياب, Najwa Karam, Mohamed Hamaki"
Smiley,2782468,282936,"There are several artists named Smiley. 
1. Andrei Tiberiu Maria, better known by his stage name Smiley, is a Romanian singer, songwriter, record producer, actor and television presenter, from Pitești. He was part of the pop groups Simplu and Radio Killer.
2. Alexander Eli Morand, known professionally as Smiley, is a Canadian rapper. He signed to hometown native Drake's OVO Sound record label, an imprint of Warner Records in 2021. The same year, he released the single ""Over the Top"" <a href=""https://www.last.fm/music/Smiley"">Read more on Last.fm</a>","Connect-R, Alex Velea, Voltaj, Carla's Dreams, Guess Who"
imase,3580623,259390,"Imase, a  artist from Japan, is a self-taught musician who learned how to create music entirely on his own in just one year. Despite producing his original songs in his bedroom, he has managed to gain a significant following on TikTok. In December 2021, he made his debut by releasing ""Have a Nice Day"" through a major label. His second release, ""Touhikou,"" became a number one hit on the TikTok Hot Song Weekly Ranking on Billboard Japan. Furthermore, his music is popular on various music streaming platforms. <a href=""https://www.last.fm/music/imase"">Read more on Last.fm</a>","Natori, Vaundy, DurdN, なとり, Fujii Kaze"
D.A.M.A,250044,12558," <a href=""https://www.last.fm/music/D.A.M.A"">Read more on Last.fm</a>","Nuno Ribeiro, DOMINGUES, Syro, ÁTOA, D'ZRT"
Billnass,6824,1032," <a href=""https://www.last.fm/music/Billnass"">Read more on Last.fm</a>","Jay Melody, Tommy Flavour, Mbosso, Darassa, Kusah"
Amrinder Gill,428348,17870,"As one of the most recognizable voices in Punjab music of the past three years, Amrinder Gill delivers yet smooth mix of delicate folk-rooted songs and up-tempo dance tunes using the extraordinary productions skills of ‘The Music Man’ Sukshinder Shinda.

Born and raised in village Boorchand Amritsar, Punjab, Amrinder Gill has become a firm favorite with the new generation of Punjabi music fans with his laid back style, up-market video and catchy Punjabi pop tracks, while having a hold over Desi lovers with his range of emotional songs. <a href=""https://www.last.fm/music/Amrinder+Gill"">Read more on Last.fm</a>","Ammy Virk, Satinder Sartaaj, Karan Aujla, Diljit Dosanjh, Garry Sandhu"
wacci,356363,26986,"wacci is a pop band from Japan.

Members :

Hashiguchi Yohei (橋口洋平) （Vocal & Guitar）　
Ono Hiroki (小野裕基) （Bass）　
Yokoyama Yusuke 横山祐介 （Drum）　
Inaba Hajime (因幡始) （Keyboard） 
Muranaka Eji  (村中慧慈) （Guitar）

official-site
official myspace
 <a href=""https://www.last.fm/music/wacci"">Read more on Last.fm</a>","Uru, back number, Sumika, Tani Yuuki, Official髭男dism"
SANTA,362351,36499,"There are multiple artists using the name 'Santa'

1) Uno Santa (宇野賛多, born March 11th, 1998), is a Japanese dancer, singer and debuted with the JPop-boygroup WARPs UP under Avex Entertainment on December 17th, 2019.
He made his solo-debut under the name of 'INTO1 SANTA' on November 25th, 2022 with the song ' I'm from… ' under his Japanese agency Avex. Since INTO1 disbanded he only goes by Santa.

2)  A Spanish heavy metal band fronted by a female singer Azuzena.  <a href=""https://www.last.fm/music/Santa"">Read more on Last.fm</a>","Waxx, Joseph Kamel, Mentissa, Pierre Garnier, Vianney"
DOROFEEVA,493336,24855,"Nadiia Volodymyrivna Dorofieieva  (born 21 April 1990 in Simferopol, Ukraine), known professionally as DOROFEEVA is a Ukrainian pop singer, fashion designer, and member of the pop duo Vremya i Steklo. In 2020 she made her debut as a solo artist with the song ""gorit"". <a href=""https://www.last.fm/music/Dorofeeva"">Read more on Last.fm</a>",
Sharn,281312,17303," <a href=""https://www.last.fm/music/Sharn"">Read more on Last.fm</a>","BIR, Jassa Dhillon, Sukha, Tegi Pannu, Laddi Chahal"
Rubi,399896,35822,"Rubi is a german actor and singer. She was born in 2000. The Remix of her song ""ONLY 4 LIFE"" gained big success in the german single charts in 2023. <a href=""https://www.last.fm/music/Rubi"">Read more on Last.fm</a>","Nina Chuba, LXE, Céline, JAMAN T, Montez"
Jeff Satur,3393310,74657,"Jeff Satur (เจฟ ซาเตอร์) is a Thai-Chinese-English singer-songwriter, actor and graphic designer under Wayfer Records. He debuted on June 7, 2013 with the digital single ""โลกแตก""

Pre-debut
Jeff joined Kamikaze in 2013 and trained for three months.

2013: Debut with ""โลกแตก""
He debuted on June 7, 2013 under the Demo Project with the digital single ""โลกแตก"". 

2018-2019: Departure and return to music <a href=""https://www.last.fm/music/Jeff+Satur"">Read more on Last.fm</a>","Nunew, Khaotung Thanawat, PP Krit, Nont Tanont, Billkin"
Nina Chuba,4127989,106092,"Nina Katrin Kaiser (born 14 October 1998), known professionally as Nina Chuba, is a German singer and actress.[2] She was born in Wedel, Schleswig-Holstein and rose to prominence in 2022 with her single ""Wildberry Lillet"", reaching number one on both the Austrian and German charts.[3][4]

At the age of seven, she began her acting career in the children's television series Die Pfefferkörner.[5] Following a move to Berlin in 2018, Chuba began releasing music, with the English-language EPs Power and Average. <a href=""https://www.last.fm/music/Nina+Chuba"">Read more on Last.fm</a>","badmómzjay, Peter Fox, Céline, Apache 207, AYLIVA"
Laddi Chahal,94855,8986," <a href=""https://www.last.fm/music/Laddi+Chahal"">Read more on Last.fm</a>","Varinder Brar, Prince Narula, Jassa Dhillon, Irshad Khan, Jaura Phagwara"
Shae Gill,693686,49606,"Shae Gill is a Pakistani singer. She is known for her song Pasoori for Coke Studio Season 14, which made her a social media sensation overnight. Her voice has mesmerized the audience, people are swooning over her voice, which is so soothing and soulful. <a href=""https://www.last.fm/music/Shae+Gill"">Read more on Last.fm</a>","Ali Sethi, Atif Aslam, Kaifi Khalil, Asim Azhar, Rahat Fateh Ali Khan"
Kaifi Khalil,342328,26902,"Kaifi Khalil (Urdu: کیفی خلیل; born 2 September 1996) is a Pakistani singer-songwriter and composer based in Karachi. He rose to prominence in 2022 after his debut in Coke Studio's Balochi song ""Kana Yaari"".  His song Kahani Suno 2.0 topped Spotify charts in Pakistan, Bangladesh and India.

He is recognized for putting a contemporary spin on traditional Balochi folk music with modern day music.
Kaifi was born and raised in Karachi's neighborhood of Lyari to a family of Baloch musicians. <a href=""https://www.last.fm/music/Kaifi+Khalil"">Read more on Last.fm</a>","Asim Azhar, Atif Aslam, Rahat Fateh Ali Khan, Ali Zafar, Abdul Hannan"
Montez,1621363,46533,"German rapper and singer, born Luca Manuel Montesinos Gargallo in Bielefeld in 1994. <a href=""https://www.last.fm/music/Montez"">Read more on Last.fm</a>","Fourty, Jamule, Bausa, Apache 207, Nina Chuba"
Anjos,78460,9650,"Em 1999 nasceram os Anjos, o grupo composto por Nelson Rosado e Sérgio Rosado deram o máximo para que o velho sonho de cantar juntos se tornasse uma realidade.
Desde muito cedo que começaram a interessar-se pela música, um gosto de família já que o pai era músico e a mãe também cantava.

Nascidos em Lisboa nos anos 1976 e 1980, respectivamente, entram para a Academia de Música aos 7 e 8 anos, Nelson aprende a tocar piano e acordeão e o Sérgio dedica-se a guitarra clássica e também piano. <a href=""https://www.last.fm/music/Anjos"">Read more on Last.fm</a>","D'ZRT, 4Taste, Nuno Ribeiro, João Pedro Pais, D.A.M.A"
SHUMEI,48657,4250," <a href=""https://www.last.fm/music/SHUMEI"">Read more on Last.fm</a>","YAKTAK, Kola, Wellboy, 100лиця, Арсен Мірзоян"
承桓,290830,16411," <a href=""https://www.last.fm/music/%E6%89%BF%E6%A1%93"">Read more on Last.fm</a>","En, 卢卢快闭嘴, LBI利比, 于冬然, 小阿七"
Tom Twers,389126,18985," <a href=""https://www.last.fm/music/Tom+Twers"">Read more on Last.fm</a>","Liaze, Adel Tawil, ESTA, 01099, Dardan"
陈壹千,37061,4146," <a href=""https://www.last.fm/music/%E9%99%88%E5%A3%B9%E5%8D%83"">Read more on Last.fm</a>","陳華, Daven Wu, 张叶蕾, KeyKey, ZQS"
Luis Vega,19606,1297," <a href=""https://www.last.fm/music/Luis+vega"">Read more on Last.fm</a>","Lu de la Tower, Orquesta Internacional A'Banda Sombra, Orquesta de Oro, Orquesta Internacional Guachambe, Agrupación EUPHORIA"
Johnny Drille,96733,13155,"John Ighodaro (born July 5, 1990), professionally known as Johnny Drille, is a Nigerian singer and songwriter.

Drille began his musical career in church. He was one of the contestants on the sixth season of Project Fame West Africa in 2013. In 2015, he released a cover of Di'Ja's ""Awww"", which caught the attention of Mavin's CEO Don Jazzy. His debut single ""Wait for Me"" was released in 2015. It was nominated for Best Alternative Song at The Headies 2016. <a href=""https://www.last.fm/music/JOHNNY+DRILLE"">Read more on Last.fm</a>",
Lyta,18340,4495,"Lyta, was born Shan Elliott on the 29th day of October 1980. She was destined for greatness in the kingdom of God. All of her life she resided on the Island of Grand Bahama in the Bahamas. Growing up in the ghetto, this young lady was determined not to let her environment dictate her final outcome in life. At the age of 15 she dedicated her life to Christ. As she dedicated her talents to the Lord, He blessed her with even more. Under her belt she possesses the gift of poetry, dance, graphic design, musical arrangement and her first love. <a href=""https://www.last.fm/music/Lyta"">Read more on Last.fm</a>","Troy Genius, Tiko Angelos, Felicia Marion, Lynette White, Wayne Stoddart"
alyona alyona,1651682,90382,"alyona alyona (real name: Alyona Olehivna Savranenko, Ukr. Альо́на Оле́гівна Савране́нко; b. June 14, 1991) is a Ukrainian rapper and songwriter. 

Alyona Savranenko was born in the village of Kapitanivka, Novomyrhorod Raion, Kirovohrad Oblast. She holds two high schools diplomas, one of which comes from the Gregory Skovoroda Pedagogical State University of Pereiaslav. Before doing rap, she worked as a teacher at ""Teremok"" kindergarten of Baryshivka, Kyiv Oblast. <a href=""https://www.last.fm/music/alyona+alyona"">Read more on Last.fm</a>","KALUSH, Jerry Heil, YAKTAK, Kola, Wellboy"
Zuchu,53234,5448,"Zuhura Othman Soud (born 22 November 1993), better known by her stage name Zuchu, is a Tanzanian singer, songwriter and recording artist signed to WCB Wasafi records label. She was awarded the Silver Play Button by YouTube for becoming the first East African female artist to exceed more than 100 000 subscribers within a week. She also became the first East African female artist to reach 1 million subscribers on YouTube 11 months later. In 2020, Zuchu was named by AFRIMMA as the Emerging Artist Award winner.  <a href=""https://www.last.fm/music/Zuchu"">Read more on Last.fm</a>","Mbosso, Jux, Nandy, Darassa, Abigail Chams"
Davy,63778,6639,"nice <a href=""https://www.last.fm/music/Davy"">Read more on Last.fm</a>","OFF THE BOOTH, vj, Kerza, Krissemane, Jore & Zpoppa"
COTERIE,140171,14567,"Coterie is a four-member Australian-New Zealand band. Formed from four brothers who were born in New Zealand and grew up in Perth, Western Australia, the band received recognition for the 2021 single ""Cool It Down"", which was a hit in New Zealand. <a href=""https://www.last.fm/music/Coterie"">Read more on Last.fm</a>","PAUA, Dear Sunday, Loose Bricks, bella amor, Miiesha"
El Boys C,17942,1405," <a href=""https://www.last.fm/music/El+Boys+C"">Read more on Last.fm</a>","Danger Man, Real Phantom, Mr. Saik, El Roockie, JHONNY D"
Fiki,170736,16009," <a href=""https://www.last.fm/music/Fiki"">Read more on Last.fm</a>","Galin, Tedi Aleksandrova, Dessita, DJ Damyan, Cvetelina Qneva"
KOLA,144273,20083,"There is more than one artist with this name: 

1. Kola is Anastasia Prudius (Анастасія Прудіус), is a popular Ukrainian singer from Kharkiv.

2. Kola is an improvisational avantgarde-group from Helsinki, Finland. Their shows are mostly improvised with musical influences from free-jazz and punk to contemporary compositions. Always open for new influences and ready for surprises - the band consists of Matti Luokkanen (saxophone), Jussi Mutenia (trumpet) and Eki Vikman (drums). <a href=""https://www.last.fm/music/Kola"">Read more on Last.fm</a>","YAKTAK, MamaRika, Wellboy, DOROFEEVA, SHUMEI"
Riar Saab,157380,16807," <a href=""https://www.last.fm/music/Riar+Saab"">Read more on Last.fm</a>","Avvy Sra, Laddi Chahal, Sharn, BIR, Jassa Dhillon"
Mohamed Mounir,622383,28840,"Mohamed Mounir or Mohammed Mounir (Arabic: محمد منير ) was born in Aswan. His music unmistakably has its roots in the various genres of Arabic and African music. And his lyrics were from all over Arabian cultures, he sang a lot of poems for the brilliant poet ""  Abd Elreheem Mansour "" and also for "" Magdy Naguib "" and "" Fouad Haddad "".  Mounir's fans sees him as a mouthpiece for the cultural and Revolution togetherness of the Orient and Occident. His music can be played at all moods, at any place. <a href=""https://www.last.fm/music/Mohamed+Mounir"">Read more on Last.fm</a>","عمر دياب, Mohamed Fouad, Bahaa Sultan, Tamer Ashour, George Wassouf"
Кореш,107109,6589," <a href=""https://www.last.fm/music/+noredirect/%D0%BA%D0%BE%D1%80%D0%B5%D1%88"">Read more on Last.fm</a>",
Chico,397700,53806,"There are six artists with the name Chico:

1) CHiCO is a Japanese female soloist who is most known for her collaboration with creator team [artist}Honeyworks{/artist] and forming CHiCO with HoneyWorks. She was a core part in the creation of many J-pop songs and openings/endings for a whole variety of anime. 

Note: Due to Spotify Tags, Many of the songs from CHiCO+with+HoneyWorks.scrobble as Chico. 

2) Yousseph ""Chico"" Slimani (born April 2, 1971) <a href=""https://www.last.fm/music/Chico"">Read more on Last.fm</a>","HoneyWorks, CHiCO with HoneyWorks, YAKTAK, Skofka, Kola"
YARMAK,192569,12296," <a href=""https://www.last.fm/music/Yarmak"">Read more on Last.fm</a>","Skofka, KALUSH, YAKTAK, SHUMEI, Артем Лоік"
Maan,1542401,61187,"Maan is a Dutch singer and actress. In 2016, she rose to national fame after winning the sixth season of the Voice of Holland. She then released her first single “Perfect World”, produced by Hardwell, which became a minor hit in the official Dutch Top 40. The follow-up “Ride It”, produced by Jack $hirak, performed similarly. The subsequent singles failed to make an impact on the charts. Maan, however, continued to remain a prominent figure on Dutch television, appearing on the popular tv-shows Beste Zangers and Dance Dance Dance. <a href=""https://www.last.fm/music/Maan"">Read more on Last.fm</a>","Flemming, Suzan & Freek, Snelle, Antoon, Nielson"
Sajfer,334906,13878," <a href=""https://www.last.fm/music/Sajfer"">Read more on Last.fm</a>","Buba Corelli, Cunami Flo, Jala Brat, Relja, Nucci"
10-FEET,1678524,61006,"Officially formed in Kyoto 2000, 10-FEET's members had made their first work (a demo tape) in 1997.  Formed as ex-members from several of the local Kyoto bands, each member brought a different style to the mix.  10-FEET had formed several connections in Kyoto that would show up later, as compilations with several artists from Kyoto (Ayano Tsuji and Kenji from DRAGON ASH for example).  Known for their lack of a single genre and their extremely powerful live performances, they stay relatively low on the mainstream's radar. <a href=""https://www.last.fm/music/10-FEET"">Read more on Last.fm</a>","ELLEGARDEN, ROTTENGRAFFTY, Hi-Standard, Ken Yokoyama, Dragon Ash"
Abdul Hannan,537908,22507,"Abdul Hannan, a Pakistani music sensation, debuted in 2010 and has since released four albums and a string of hit music. His singles ""Bikhra"" and  ""Iraaday""  played a pivotal role in revitalizing the Pakistani music scene on Spotify in 2022, amassing over 50 million streams each and securing the #1 and #2 spots for the year. He also popularized indie music to Pakistan, dethroning the global hit  ""Pasoori"" and topping charts with tracks like """"Siyah"",  ""Haaray"" and  ""Raabta"". <a href=""https://www.last.fm/music/Abdul+Hannan"">Read more on Last.fm</a>","Rovalio, Bayaan, Young Stunners, maanu, Talha Anjum"
陳華,107849,9172," <a href=""https://www.last.fm/music/%E9%99%B3%E8%8F%AF"">Read more on Last.fm</a>","艾薇, Vicky Chen, 曾瑋中, Xiao Bing Chih, 李浩瑋 Howard Lee"
Lely45,202225,14840," <a href=""https://www.last.fm/music/Lely45"">Read more on Last.fm</a>","Tember Blanche, renie cares, daKooka, Vivienne Mort, хейтспіч"
ريفو شو,79547,4721," <a href=""https://www.last.fm/music/%D8%B1%D9%8A%D9%81%D9%88+%D8%B4%D9%88"">Read more on Last.fm</a>","YONYO, Ilmond, Cairokee Production, Youssif Elashry, Galaleo"
Farid,153240,33737," <a href=""https://www.last.fm/music/Farid"">Read more on Last.fm</a>","Ramy Gamal, Ramy Sabry, Ahmed Saad, Muslim, Tamer Ashour"
DJ Damyan,58659,3423," <a href=""https://www.last.fm/music/DJ+Damyan"">Read more on Last.fm</a>","Dessita, Djordan, Galin, DONIKA, Emanuela"
Arjun Kanungo,424255,30248," <a href=""https://www.last.fm/music/Arjun+Kanungo"">Read more on Last.fm</a>","Vishal Mishra, Aditya Rikhari, Gajendra Verma, Sachet Tandon, Badshah"
Balloranking,59916,1962," <a href=""https://www.last.fm/music/Balloranking"">Read more on Last.fm</a>","BhadBoi OML, Tml Vibez, Vibez Inc, Rybeena, T.I BLAZE"
Artem Pivovarov,292323,11956,"Artem Pivovarov (Артем Пивоваров or Артём Пивоваров, Artyom Pyvovarov; born 28 June 1991 in Vovchansk, Ukraine) is a Ukrainian new wave singer-songwriter and producer. The Ukrainian star is becoming a huge hit in his country with ""Дежавю."" <a href=""https://www.last.fm/music/Artem+Pivovarov"">Read more on Last.fm</a>","Antytila, Positiff, Sasha Chemerov, Osty, BEZ OBMEZHEN"
Taaruk Raina,243890,19589,"Taaruk Raina was born on 29 September 1994 in Mumbai, Maharashtra, India. He is an actor/singer known for Purple (2018), Mismatched (2020) and Songs of Paradise. <a href=""https://www.last.fm/music/Taaruk+Raina"">Read more on Last.fm</a>","Vismay Patel, Aditya Rikhari, Zaeden, Pratsofficial, Deepak Rathore Project"
SKYLERR,33773,3328," <a href=""https://www.last.fm/music/skylerr"">Read more on Last.fm</a>","Анна Трінчер, Positiff, Yagody, Golubenko, nichka"
Alamat,1178833,31002,"Alamat is a Filipino boy band formed in 2020 by Viva Artist Agency and Ninuno Media. The group consists of six members: Taneo, Mo, Jao, Tomás, R-Ji and Alas. Originally a nine-piece ensemble, they were formed through PWEDE: The National Boyband Search, the group distinguishes itself as a multilingual and multiethnic boy band that sings in seven Philippine languages: Tagalog, Ilocano, Kapampangan, Cebuano, Hiligaynon, Bikolano, and Waray-Waray. After training for nine months <a href=""https://www.last.fm/music/ALAMAT"">Read more on Last.fm</a>","VXON, Bini, SB19, Cup of Joe, Felip"
CIVO,976699,31945," <a href=""https://www.last.fm/music/CIVO"">Read more on Last.fm</a>","Fourty, Art, Montez, Jamule, 1986zig"
ENKAY,110450,7196," <a href=""https://www.last.fm/music/eNKay"">Read more on Last.fm</a>","Moritz Garth, Florentina, Mo-Torres, LEA x LINDA, Achtabahn"
Son Mieux,1089588,64658,"Established in 2015 in The Hague, The Netherlands, Son Mieux is the seven-headed Dutch indie band formed around singer and songwriter, Camiel Meiresonne. 

After an EP, Vice Versa (2016), they released their début fill-length, Faire de Son Mieux (which is French for: 'Getting the most out yourself') in February 2019. The album features ten pop songs brimming with irresistible hooks and choruses. Think personal stories in the best folk tradition, each with an electronic sub-layer. <a href=""https://www.last.fm/music/Son+Mieux"">Read more on Last.fm</a>","Di-rect, Racoon, Rondé, Goldband, BLØF"
